[
  {
    "role": "acquirer",
    "message": "**Official Negotiation Statement:**\n\nWe appreciate the opportunity to engage in this acquisition discussion with GreenWood Solutions Pvt. Ltd. and recognize the strategic alignment our companies share in sustainable forestry and wood product innovation. \n\nWe propose an acquisition valued at $27.5 million, reflecting a 1.5 times multiple on your revenues, considering your strong R&D capabilities and market position. The payment structure would be 70% cash upfront and 30% in stock, with an earn-out provision of 10% tied to achieving specific revenue targets over two years. This structure aligns our interests and ensures continued commitment from your management team.\n\nThe synergies are evident in our shared commitment to sustainability and the potential to integrate our R&D efforts, enhancing our product offerings and market reach. However, we foresee potential friction in cultural integration and scalability of your niche products, which we are willing to address collaboratively.\n\nWe propose a due diligence period of 8-10 weeks, followed by the signing of definitive agreements, aiming for a swift closing. We are eager to move forward and are open to further discussions to finalize terms.\n\n**Term Sheet:**\n\n```json\n{\n  \"valuation\": \"$27.5 million\",\n  \"payment_structure\": \"70% cash upfront, 30% stock\",\n  \"earn_out\": \"10% tied to revenue targets over two years\",\n  \"due_diligence_timeline\": \"8-10 weeks\",\n  \"other_key_terms\": \"Integration of R&D, collaborative management\"\n}\n```\n\n**Company Negotiation State:** pending",
    "reasoning": "",
    "query": "No prior negotiation history exists. \nBegin the negotiation to acquire the TARGET company by providing your initial official statement. \n\nFocus on these M&A deal points:\n- Valuation (provide a numeric figure or multiple, e.g. $XX million, X times revenue, etc.)\n- Payment Structure (cash, stock, earn-out terms, etc.)\n- Key Synergies and Potential Friction (where do you see alignment or conflict?)\n- Due Diligence / Timeline (how long for diligence, when to sign definitive agreements?)\n\nRemember:\n- Push for your company's best interests\n- Reflect your company's culture, authority dynamics, and unspoken interests\n- Do not include salutations or sign-offs\n- Maintain a professional, concise tone\n\nPlease append a term sheet in **JSON** at the end of your response. \nUse a structure like:\n```json\n{{\n  \"valuation\": \"...\",\n  \"payment_structure\": \"...\",\n  \"earn_out\": \"...\",\n  \"due_diligence_timeline\": \"...\",\n  \"other_key_terms\": \"...\",\n  ...\n}}\n```\n\nFinally, be sure to end with:\n\nCompany Negotiation State: [pending or complete].\n\n- pending: your company still wishes to negotiate the terms\n- complete: your company is satified and will agree to the terms\n <think>",
    "negotiation_state": "pending",
    "term_sheet_snapshot": {
      "valuation": "$27.5 million",
      "payment_structure": "70% cash upfront, 30% stock",
      "earn_out": "10% tied to revenue targets over two years",
      "due_diligence_timeline": "8-10 weeks",
      "other_key_terms": "Integration of R&D, collaborative management"
    }
  },
  {
    "role": "target",
    "message": "We appreciate your proposal and recognize the strategic potential of this acquisition. After careful consideration, we propose the following adjustments to ensure alignment with GreenWood Solutions' core values and long-term goals:\n\n1. **Valuation**: We propose a valuation of $28 million, reflecting our strong R&D capabilities and market position.\n\n2. **Payment Structure**: We suggest an 80% cash upfront and 20% stock structure to provide greater certainty and value for our stakeholders.\n\n3. **Earn-out**: We recommend reducing the earn-out to 5%, tied to maintaining R&D spending levels, ensuring our innovation focus remains central.\n\n4. **Synergies**: We propose establishing a joint R&D committee to oversee integration and maintain our eco-friendly product focus.\n\n5. **Due Diligence Timeline**: We accept the 8-10 week period but request flexibility to ensure thorough review.\n\n6. **Cultural Fit and Sustainability**: We emphasize the importance of maintaining our R&D autonomy and cultural values, ensuring a smooth integration.\n\n**Updated Term Sheet:**\n\n```json\n{\n  \"valuation\": \"$28 million\",\n  \"payment_structure\": \"80% cash upfront, 20% stock\",\n  \"earn_out\": \"5% tied to R&D spending levels\",\n  \"due_diligence_timeline\": \"8-10 weeks with flexibility\",\n  \"other_key_terms\": \"Joint R&D committee, R&D budget maintenance\"\n}\n```\n\n**Company Negotiation State:** pending\n\nThis structured approach ensures we meet our strategic goals while fostering a collaborative partnership.",
    "reasoning": "",
    "query": "Below is the ongoing negotiation history between your company and the other party. \nContinue the conversation by providing your company's official negotiation response. \n\nFocus on these M&A deal points:\n- Valuation (provide a numeric figure or multiple, e.g. $XX million, X times revenue, etc.)\n- Payment Structure (cash, stock, earn-out terms, etc.)\n- Key Synergies and Potential Friction (where do you see alignment or conflict?)\n- Due Diligence / Timeline (how long for diligence, when to sign definitive agreements?)\n- Any Pending Requests from the other side not yet addressed\n\nRemember:\n- Push for your company's best interests\n- Reflect your company's culture, authority dynamics, and unspoken interests\n- Do not include salutations or sign-offs\n- Maintain a professional, concise tone\n\nIf you propose or change any terms, please append an updated term sheet in **JSON** at the end of your response. \nUse a structure like:\n```json\n{\n  \"valuation\": \"...\",\n  \"payment_structure\": \"...\",\n  \"earn_out\": \"...\",\n  \"due_diligence_timeline\": \"...\",\n  \"other_key_terms\": \"...\",\n  ...\n}\n```\nIf you do not propose any changes, you can reaffirm existing terms or omit the JSON.\n\nFinally, be sure to end with:\n\nCompany Negotiation State: [pending or complete].\n\n- pending: your company still wishes to negotiate the terms\n- complete: your company is satified and will agree to the terms\n\nNegotiation History: \nACQUIRER:\n**Official Negotiation Statement:**\n\nWe appreciate the opportunity to engage in this acquisition discussion with GreenWood Solutions Pvt. Ltd. and recognize the strategic alignment our companies share in sustainable forestry and wood product innovation. \n\nWe propose an acquisition valued at $27.5 million, reflecting a 1.5 times multiple on your revenues, considering your strong R&D capabilities and market position. The payment structure would be 70% cash upfront and 30% in stock, with an earn-out provision of 10% tied to achieving specific revenue targets over two years. This structure aligns our interests and ensures continued commitment from your management team.\n\nThe synergies are evident in our shared commitment to sustainability and the potential to integrate our R&D efforts, enhancing our product offerings and market reach. However, we foresee potential friction in cultural integration and scalability of your niche products, which we are willing to address collaboratively.\n\nWe propose a due diligence period of 8-10 weeks, followed by the signing of definitive agreements, aiming for a swift closing. We are eager to move forward and are open to further discussions to finalize terms.\n\n**Term Sheet:**\n\n```json\n{\n  \"valuation\": \"$27.5 million\",\n  \"payment_structure\": \"70% cash upfront, 30% stock\",\n  \"earn_out\": \"10% tied to revenue targets over two years\",\n  \"due_diligence_timeline\": \"8-10 weeks\",\n  \"other_key_terms\": \"Integration of R&D, collaborative management\"\n}\n```\n\n**Company Negotiation State:** pending\n <think> <think>",
    "negotiation_state": "pending",
    "term_sheet_snapshot": {
      "valuation": "$28 million",
      "payment_structure": "80% cash upfront, 20% stock",
      "earn_out": "5% tied to R&D spending levels",
      "due_diligence_timeline": "8-10 weeks with flexibility",
      "other_key_terms": "Joint R&D committee, R&D budget maintenance"
    }
  },
  {
    "role": "acquirer",
    "message": "**Official Negotiation Statement:**\n\nWe acknowledge your counteroffer and appreciate the detailed considerations. After careful review, we are pleased to accept the valuation of $28 million, recognizing the strategic value your company brings, particularly in R&D and sustainable practices.\n\nRegarding the payment structure, we propose a balanced approach of 75% cash upfront and 25% stock, ensuring a fair compromise that respects both parties' interests. We agree to the earn-out structure of 5% tied to R&D spending levels, aligning with our shared commitment to innovation and sustainability.\n\nWe support the establishment of a joint R&D committee to foster collaboration and maintain your company's R&D autonomy, crucial for a seamless integration. The due diligence timeline remains at 8-10 weeks, with flexibility as requested, to ensure a thorough process.\n\nWe recognize the importance of cultural fit and sustainability, ensuring a smooth transition that respects your values. The synergies from integrating our R&D efforts and expanding market reach are significant, and we are committed to addressing potential friction points proactively.\n\n**Term Sheet:**\n\n```json\n{\n  \"valuation\": \"$28 million\",\n  \"payment_structure\": \"75% cash upfront, 25% stock\",\n  \"earn_out\": \"5% tied to R&D spending levels\",\n  \"due_diligence_timeline\": \"8-10 weeks with flexibility\",\n  \"other_key_terms\": \"Joint R&D committee, R&D budget maintenance\"\n}\n```\n\n**Company Negotiation State:** complete\n\nThis structured approach ensures a strategic and collaborative partnership, aligning our goals for innovation and sustainability.",
    "reasoning": "",
    "query": "Below is the ongoing negotiation history between your company and the other party. \nContinue the conversation by providing your company's official negotiation response. \n\nFocus on these M&A deal points:\n- Valuation (provide a numeric figure or multiple, e.g. $XX million, X times revenue, etc.)\n- Payment Structure (cash, stock, earn-out terms, etc.)\n- Key Synergies and Potential Friction (where do you see alignment or conflict?)\n- Due Diligence / Timeline (how long for diligence, when to sign definitive agreements?)\n- Any Pending Requests from the other side not yet addressed\n\nRemember:\n- Push for your company's best interests\n- Reflect your company's culture, authority dynamics, and unspoken interests\n- Do not include salutations or sign-offs\n- Maintain a professional, concise tone\n\nIf you propose or change any terms, please append an updated term sheet in **JSON** at the end of your response. \nUse a structure like:\n```json\n{\n  \"valuation\": \"...\",\n  \"payment_structure\": \"...\",\n  \"earn_out\": \"...\",\n  \"due_diligence_timeline\": \"...\",\n  \"other_key_terms\": \"...\",\n  ...\n}\n```\nIf you do not propose any changes, you can reaffirm existing terms or omit the JSON.\n\nFinally, be sure to end with:\n\nCompany Negotiation State: [pending or complete].\n\n- pending: your company still wishes to negotiate the terms\n- complete: your company is satified and will agree to the terms\n\nNegotiation History: \nACQUIRER:\n**Official Negotiation Statement:**\n\nWe appreciate the opportunity to engage in this acquisition discussion with GreenWood Solutions Pvt. Ltd. and recognize the strategic alignment our companies share in sustainable forestry and wood product innovation. \n\nWe propose an acquisition valued at $27.5 million, reflecting a 1.5 times multiple on your revenues, considering your strong R&D capabilities and market position. The payment structure would be 70% cash upfront and 30% in stock, with an earn-out provision of 10% tied to achieving specific revenue targets over two years. This structure aligns our interests and ensures continued commitment from your management team.\n\nThe synergies are evident in our shared commitment to sustainability and the potential to integrate our R&D efforts, enhancing our product offerings and market reach. However, we foresee potential friction in cultural integration and scalability of your niche products, which we are willing to address collaboratively.\n\nWe propose a due diligence period of 8-10 weeks, followed by the signing of definitive agreements, aiming for a swift closing. We are eager to move forward and are open to further discussions to finalize terms.\n\n**Term Sheet:**\n\n```json\n{\n  \"valuation\": \"$27.5 million\",\n  \"payment_structure\": \"70% cash upfront, 30% stock\",\n  \"earn_out\": \"10% tied to revenue targets over two years\",\n  \"due_diligence_timeline\": \"8-10 weeks\",\n  \"other_key_terms\": \"Integration of R&D, collaborative management\"\n}\n```\n\n**Company Negotiation State:** pending\nTARGET:\nWe appreciate your proposal and recognize the strategic potential of this acquisition. After careful consideration, we propose the following adjustments to ensure alignment with GreenWood Solutions' core values and long-term goals:\n\n1. **Valuation**: We propose a valuation of $28 million, reflecting our strong R&D capabilities and market position.\n\n2. **Payment Structure**: We suggest an 80% cash upfront and 20% stock structure to provide greater certainty and value for our stakeholders.\n\n3. **Earn-out**: We recommend reducing the earn-out to 5%, tied to maintaining R&D spending levels, ensuring our innovation focus remains central.\n\n4. **Synergies**: We propose establishing a joint R&D committee to oversee integration and maintain our eco-friendly product focus.\n\n5. **Due Diligence Timeline**: We accept the 8-10 week period but request flexibility to ensure thorough review.\n\n6. **Cultural Fit and Sustainability**: We emphasize the importance of maintaining our R&D autonomy and cultural values, ensuring a smooth integration.\n\n**Updated Term Sheet:**\n\n```json\n{\n  \"valuation\": \"$28 million\",\n  \"payment_structure\": \"80% cash upfront, 20% stock\",\n  \"earn_out\": \"5% tied to R&D spending levels\",\n  \"due_diligence_timeline\": \"8-10 weeks with flexibility\",\n  \"other_key_terms\": \"Joint R&D committee, R&D budget maintenance\"\n}\n```\n\n**Company Negotiation State:** pending\n\nThis structured approach ensures we meet our strategic goals while fostering a collaborative partnership.\n <think>",
    "negotiation_state": "complete",
    "term_sheet_snapshot": {
      "valuation": "$28 million",
      "payment_structure": "75% cash upfront, 25% stock",
      "earn_out": "5% tied to R&D spending levels",
      "due_diligence_timeline": "8-10 weeks with flexibility",
      "other_key_terms": "Joint R&D committee, R&D budget maintenance"
    }
  },
  {
    "role": "target",
    "message": "**Official Negotiation Statement:**\n\nWe appreciate your willingness to compromise and recognize the strategic benefits this acquisition presents for both parties. We are pleased to accept the valuation of $28 million and acknowledge the adjusted payment structure of 75% cash upfront and 25% stock, which provides a balanced approach respecting both parties' interests.\n\nThe earn-out structure of 5% tied to R&D spending levels is acceptable, as it aligns with our shared commitment to innovation and sustainability. We agree to the 8-10 week due diligence timeline with the requested flexibility to ensure a thorough review process.\n\nWe emphasize the importance of establishing a joint R&D committee to oversee the integration of our research and development efforts, ensuring that GreenWood Solutions' R&D autonomy and eco-friendly product focus remain central to the merged entity. This collaboration will be crucial for maintaining our operational independence in advanced manufacturing processes and fostering a smooth cultural integration.\n\nWe recognize the synergies in our shared commitment to sustainability and the potential to enhance our product offerings and market reach. We are committed to addressing potential friction points proactively, particularly in cultural integration and scalability of our niche products.\n\n**Term Sheet:**\n\n```json\n{\n  \"valuation\": \"$28 million\",\n  \"payment_structure\": \"75% cash upfront, 25% stock\",\n  \"earn_out\": \"5% tied to R&D spending levels\",\n  \"due_diligence_timeline\": \"8-10 weeks with flexibility\",\n  \"other_key_terms\": \"Joint R&D committee, R&D budget maintenance, operational autonomy in advanced manufacturing\"\n}\n```\n\n**Company Negotiation State:** complete",
    "reasoning": "",
    "query": "Below is the ongoing negotiation history between your company and the other party. \nContinue the conversation by providing your company's official negotiation response. \n\nFocus on these M&A deal points:\n- Valuation (provide a numeric figure or multiple, e.g. $XX million, X times revenue, etc.)\n- Payment Structure (cash, stock, earn-out terms, etc.)\n- Key Synergies and Potential Friction (where do you see alignment or conflict?)\n- Due Diligence / Timeline (how long for diligence, when to sign definitive agreements?)\n- Any Pending Requests from the other side not yet addressed\n\nRemember:\n- Push for your company's best interests\n- Reflect your company's culture, authority dynamics, and unspoken interests\n- Do not include salutations or sign-offs\n- Maintain a professional, concise tone\n\nIf you propose or change any terms, please append an updated term sheet in **JSON** at the end of your response. \nUse a structure like:\n```json\n{\n  \"valuation\": \"...\",\n  \"payment_structure\": \"...\",\n  \"earn_out\": \"...\",\n  \"due_diligence_timeline\": \"...\",\n  \"other_key_terms\": \"...\",\n  ...\n}\n```\nIf you do not propose any changes, you can reaffirm existing terms or omit the JSON.\n\nFinally, be sure to end with:\n\nCompany Negotiation State: [pending or complete].\n\n- pending: your company still wishes to negotiate the terms\n- complete: your company is satified and will agree to the terms\n\nNegotiation History: \nACQUIRER:\n**Official Negotiation Statement:**\n\nWe appreciate the opportunity to engage in this acquisition discussion with GreenWood Solutions Pvt. Ltd. and recognize the strategic alignment our companies share in sustainable forestry and wood product innovation. \n\nWe propose an acquisition valued at $27.5 million, reflecting a 1.5 times multiple on your revenues, considering your strong R&D capabilities and market position. The payment structure would be 70% cash upfront and 30% in stock, with an earn-out provision of 10% tied to achieving specific revenue targets over two years. This structure aligns our interests and ensures continued commitment from your management team.\n\nThe synergies are evident in our shared commitment to sustainability and the potential to integrate our R&D efforts, enhancing our product offerings and market reach. However, we foresee potential friction in cultural integration and scalability of your niche products, which we are willing to address collaboratively.\n\nWe propose a due diligence period of 8-10 weeks, followed by the signing of definitive agreements, aiming for a swift closing. We are eager to move forward and are open to further discussions to finalize terms.\n\n**Term Sheet:**\n\n```json\n{\n  \"valuation\": \"$27.5 million\",\n  \"payment_structure\": \"70% cash upfront, 30% stock\",\n  \"earn_out\": \"10% tied to revenue targets over two years\",\n  \"due_diligence_timeline\": \"8-10 weeks\",\n  \"other_key_terms\": \"Integration of R&D, collaborative management\"\n}\n```\n\n**Company Negotiation State:** pending\nTARGET:\nWe appreciate your proposal and recognize the strategic potential of this acquisition. After careful consideration, we propose the following adjustments to ensure alignment with GreenWood Solutions' core values and long-term goals:\n\n1. **Valuation**: We propose a valuation of $28 million, reflecting our strong R&D capabilities and market position.\n\n2. **Payment Structure**: We suggest an 80% cash upfront and 20% stock structure to provide greater certainty and value for our stakeholders.\n\n3. **Earn-out**: We recommend reducing the earn-out to 5%, tied to maintaining R&D spending levels, ensuring our innovation focus remains central.\n\n4. **Synergies**: We propose establishing a joint R&D committee to oversee integration and maintain our eco-friendly product focus.\n\n5. **Due Diligence Timeline**: We accept the 8-10 week period but request flexibility to ensure thorough review.\n\n6. **Cultural Fit and Sustainability**: We emphasize the importance of maintaining our R&D autonomy and cultural values, ensuring a smooth integration.\n\n**Updated Term Sheet:**\n\n```json\n{\n  \"valuation\": \"$28 million\",\n  \"payment_structure\": \"80% cash upfront, 20% stock\",\n  \"earn_out\": \"5% tied to R&D spending levels\",\n  \"due_diligence_timeline\": \"8-10 weeks with flexibility\",\n  \"other_key_terms\": \"Joint R&D committee, R&D budget maintenance\"\n}\n```\n\n**Company Negotiation State:** pending\n\nThis structured approach ensures we meet our strategic goals while fostering a collaborative partnership.\nACQUIRER:\n**Official Negotiation Statement:**\n\nWe acknowledge your counteroffer and appreciate the detailed considerations. After careful review, we are pleased to accept the valuation of $28 million, recognizing the strategic value your company brings, particularly in R&D and sustainable practices.\n\nRegarding the payment structure, we propose a balanced approach of 75% cash upfront and 25% stock, ensuring a fair compromise that respects both parties' interests. We agree to the earn-out structure of 5% tied to R&D spending levels, aligning with our shared commitment to innovation and sustainability.\n\nWe support the establishment of a joint R&D committee to foster collaboration and maintain your company's R&D autonomy, crucial for a seamless integration. The due diligence timeline remains at 8-10 weeks, with flexibility as requested, to ensure a thorough process.\n\nWe recognize the importance of cultural fit and sustainability, ensuring a smooth transition that respects your values. The synergies from integrating our R&D efforts and expanding market reach are significant, and we are committed to addressing potential friction points proactively.\n\n**Term Sheet:**\n\n```json\n{\n  \"valuation\": \"$28 million\",\n  \"payment_structure\": \"75% cash upfront, 25% stock\",\n  \"earn_out\": \"5% tied to R&D spending levels\",\n  \"due_diligence_timeline\": \"8-10 weeks with flexibility\",\n  \"other_key_terms\": \"Joint R&D committee, R&D budget maintenance\"\n}\n```\n\n**Company Negotiation State:** complete\n\nThis structured approach ensures a strategic and collaborative partnership, aligning our goals for innovation and sustainability.\n <think>",
    "negotiation_state": "complete",
    "term_sheet_snapshot": {
      "valuation": "$28 million",
      "payment_structure": "75% cash upfront, 25% stock",
      "earn_out": "5% tied to R&D spending levels",
      "due_diligence_timeline": "8-10 weeks with flexibility",
      "other_key_terms": "Joint R&D committee, R&D budget maintenance, operational autonomy in advanced manufacturing"
    }
  }
]