[
  {
    "role": "acquirer",
    "message": "True North Timber Co. is pleased to initiate discussions for the acquisition of Verde Madera Industries. Our proposal reflects a strategic alignment with both companies' commitments to sustainability and growth in the forestry sector.\n\nWe propose a valuation of $50 million, representing 1.5 times Verde Madera's annual revenue, recognizing the company's strong position in sustainable wood products. The payment structure will be 70% cash and 30% stock in True North Timber Co., ensuring alignment with our long-term vision.\n\nKey synergies include integrating Verde Madera's innovative eco-friendly practices and expanding our market presence in Brazil. Potential friction points, such as cultural integration, will be addressed through collaborative communication and mutual respect.\n\nWe plan an 8-week due diligence period to review operational, financial, and environmental practices. A signing date is proposed for 10 weeks from now, with a 20% earn-out based on EBITDA growth over three years post-acquisition.\n\nThis offer is pending further negotiation to ensure alignment with both companies' strategic goals.\n\n```json\n{\n  \"valuation\": \"$50 million\",\n  \"payment_structure\": \"70% cash, 30% stock\",\n  \"earn_out\": \"Up to 20% based on EBITDA growth over 3 years\",\n  \"due_diligence_timeline\": \"8 weeks\",\n  \"signing_date\": \"10 weeks from the start of negotiations\",\n  \"other_key_terms\": {\n    \"sustainability_commitment\": \"Alignment with eco-friendly practices\",\n    \"technological_integration\": \"Adoption of Verde Madera's advanced technologies\"\n  }\n}\n```\n\nCompany Negotiation State: pending",
    "reasoning": "",
    "query": "No prior negotiation history exists. \nBegin the negotiation to acquire the TARGET company by providing your initial official statement. \n\nFocus on these M&A deal points:\n- Valuation (provide a numeric figure or multiple, e.g. $XX million, X times revenue, etc.)\n- Payment Structure (cash, stock, earn-out terms, etc.)\n- Key Synergies and Potential Friction (where do you see alignment or conflict?)\n- Due Diligence / Timeline (how long for diligence, when to sign definitive agreements?)\n\nRemember:\n- Push for your company's best interests\n- Reflect your company's culture, authority dynamics, and unspoken interests\n- Do not include salutations or sign-offs\n- Maintain a professional, concise tone\n\nPlease append a term sheet in **JSON** at the end of your response. \nUse a structure like:\n```json\n{{\n  \"valuation\": \"...\",\n  \"payment_structure\": \"...\",\n  \"earn_out\": \"...\",\n  \"due_diligence_timeline\": \"...\",\n  \"other_key_terms\": \"...\",\n  ...\n}}\n```\n\nFinally, be sure to end with:\n\nCompany Negotiation State: [pending or complete].\n\n- pending: your company still wishes to negotiate the terms\n- complete: your company is satified and will agree to the terms\n <think>",
    "negotiation_state": "pending",
    "term_sheet_snapshot": {
      "valuation": "$50 million",
      "payment_structure": "70% cash, 30% stock",
      "earn_out": "Up to 20% based on EBITDA growth over 3 years",
      "due_diligence_timeline": "8 weeks",
      "signing_date": "10 weeks from the start of negotiations",
      "other_key_terms": {
        "sustainability_commitment": "Alignment with eco-friendly practices",
        "technological_integration": "Adoption of Verde Madera's advanced technologies"
      }
    }
  },
  {
    "role": "target",
    "message": "Verde Madera Industries appreciates the proposal from True North Timber Co. and recognizes the strategic alignment between our companies. We are pleased to see the emphasis on sustainability and mutual growth. However, we believe certain aspects of the offer can be further refined to reflect the full value and potential of our company.\n\n**Valuation:**\nWe propose revising the valuation to $75 million, representing 1.5 times our annual revenue at the higher end of our range. This adjustment accounts for our strong market position, growth potential, and the unique value of our sustainable practices.\n\n**Payment Structure:**\nWe suggest modifying the payment structure to 80% cash and 20% stock. This change ensures immediate value for our shareholders while maintaining alignment with long-term goals through equity participation.\n\n**Earn-out:**\nWe recommend expanding the earn-out structure to include specific sustainability metrics alongside EBITDA growth, ensuring our environmental commitments remain central to the agreement.\n\n**Due Diligence and Timeline:**\nTo ensure a thorough review, we propose extending the due diligence period to 10 weeks and the signing date to 12 weeks from the start of negotiations.\n\n**Key Synergies and Potential Friction:**\nWe highlight the alignment in sustainability and international market expansion. However, we must safeguard our operational independence in R&D and eco-friendly practices to preserve our core identity.\n\n**Unspoken Interests:**\nWe emphasize the importance of maintaining our operational independence and sustainability practices, crucial for our continued growth and market presence.\n\n```json\n{\n  \"valuation\": \"$75 million\",\n  \"payment_structure\": \"80% cash, 20% stock\",\n  \"earn_out\": \"Up to 20% based on EBITDA growth and sustainability metrics over 3 years\",\n  \"due_diligence_timeline\": \"10 weeks\",\n  \"signing_date\": \"12 weeks from the start of negotiations\",\n  \"other_key_terms\": {\n    \"sustainability_commitment\": \"Maintenance of Verde Madera's operational independence in R&D and eco-friendly practices\",\n    \"technological_integration\": \"Adoption of Verde Madera's advanced technologies with preserved autonomy\"\n  }\n}\n```\n\nCompany Negotiation State: pending",
    "reasoning": "",
    "query": "Below is the ongoing negotiation history between your company and the other party. \nContinue the conversation by providing your company's official negotiation response. \n\nFocus on these M&A deal points:\n- Valuation (provide a numeric figure or multiple, e.g. $XX million, X times revenue, etc.)\n- Payment Structure (cash, stock, earn-out terms, etc.)\n- Key Synergies and Potential Friction (where do you see alignment or conflict?)\n- Due Diligence / Timeline (how long for diligence, when to sign definitive agreements?)\n- Any Pending Requests from the other side not yet addressed\n\nRemember:\n- Push for your company's best interests\n- Reflect your company's culture, authority dynamics, and unspoken interests\n- Do not include salutations or sign-offs\n- Maintain a professional, concise tone\n\nIf you propose or change any terms, please append an updated term sheet in **JSON** at the end of your response. \nUse a structure like:\n```json\n{\n  \"valuation\": \"...\",\n  \"payment_structure\": \"...\",\n  \"earn_out\": \"...\",\n  \"due_diligence_timeline\": \"...\",\n  \"other_key_terms\": \"...\",\n  ...\n}\n```\nIf you do not propose any changes, you can reaffirm existing terms or omit the JSON.\n\nFinally, be sure to end with:\n\nCompany Negotiation State: [pending or complete].\n\n- pending: your company still wishes to negotiate the terms\n- complete: your company is satified and will agree to the terms\n\nNegotiation History: \nACQUIRER:\nTrue North Timber Co. is pleased to initiate discussions for the acquisition of Verde Madera Industries. Our proposal reflects a strategic alignment with both companies' commitments to sustainability and growth in the forestry sector.\n\nWe propose a valuation of $50 million, representing 1.5 times Verde Madera's annual revenue, recognizing the company's strong position in sustainable wood products. The payment structure will be 70% cash and 30% stock in True North Timber Co., ensuring alignment with our long-term vision.\n\nKey synergies include integrating Verde Madera's innovative eco-friendly practices and expanding our market presence in Brazil. Potential friction points, such as cultural integration, will be addressed through collaborative communication and mutual respect.\n\nWe plan an 8-week due diligence period to review operational, financial, and environmental practices. A signing date is proposed for 10 weeks from now, with a 20% earn-out based on EBITDA growth over three years post-acquisition.\n\nThis offer is pending further negotiation to ensure alignment with both companies' strategic goals.\n\n```json\n{\n  \"valuation\": \"$50 million\",\n  \"payment_structure\": \"70% cash, 30% stock\",\n  \"earn_out\": \"Up to 20% based on EBITDA growth over 3 years\",\n  \"due_diligence_timeline\": \"8 weeks\",\n  \"signing_date\": \"10 weeks from the start of negotiations\",\n  \"other_key_terms\": {\n    \"sustainability_commitment\": \"Alignment with eco-friendly practices\",\n    \"technological_integration\": \"Adoption of Verde Madera's advanced technologies\"\n  }\n}\n```\n\nCompany Negotiation State: pending\n <think>",
    "negotiation_state": "pending",
    "term_sheet_snapshot": {
      "valuation": "$75 million",
      "payment_structure": "80% cash, 20% stock",
      "earn_out": "Up to 20% based on EBITDA growth and sustainability metrics over 3 years",
      "due_diligence_timeline": "10 weeks",
      "signing_date": "12 weeks from the start of negotiations",
      "other_key_terms": {
        "sustainability_commitment": "Maintenance of Verde Madera's operational independence in R&D and eco-friendly practices",
        "technological_integration": "Adoption of Verde Madera's advanced technologies with preserved autonomy"
      }
    }
  },
  {
    "role": "acquirer",
    "message": "**Official Negotiation Response from True North Timber Co.:**\n\nWe appreciate Verde Madera Industries' thoughtful counterproposal and acknowledge the strategic alignment between our companies. Our aim is to reach a mutually beneficial agreement that respects both parties' interests while driving sustainable growth.\n\n**Valuation:**\nWe are prepared to consider a valuation of $60 million, representing a multiple closer to the higher end of the target's revenue range. This reflects the value we place on Verde Madera's market position and growth potential.\n\n**Payment Structure:**\nWe propose a payment structure of 75% cash and 25% stock. This adjustment provides immediate value to Verde Madera's shareholders while maintaining a significant equity stake to align our long-term interests.\n\n**Earn-out:**\nWe agree to an earn-out structure that includes both EBITDA growth and sustainability metrics. Specifically, we propose a 20% earn-out, with 15% tied to EBITDA growth and 5% tied to achieving specific sustainability milestones.\n\n**Due Diligence and Timeline:**\nWe accept extending the due diligence period to 9 weeks and the signing date to 11 weeks, striking a balance between thoroughness and expediency.\n\n**Operational Independence:**\nWe respect Verde Madera's desire to maintain operational independence in R&D and eco-friendly practices. We propose establishing a joint committee to ensure collaboration while preserving autonomy, allowing for the sharing of best practices.\n\n**Unspoken Interests:**\nWe emphasize the importance of accessing sustainable raw materials and advanced technologies, which will be structured into the agreement with specific clauses ensuring resource access and technology sharing.\n\n```json\n{\n  \"valuation\": \"$60 million\",\n  \"payment_structure\": \"75% cash, 25% stock\",\n  \"earn_out\": \"Up to 20% (15% based on EBITDA growth, 5% on sustainability metrics) over 3 years\",\n  \"due_diligence_timeline\": \"9 weeks\",\n  \"signing_date\": \"11 weeks from the start of negotiations\",\n  \"other_key_terms\": {\n    \"sustainability_commitment\": \"Inclusion of specific sustainability milestones in earn-out\",\n    \"technological_integration\": \"Joint committee for collaboration while preserving R&D autonomy\"\n  }\n}\n```\n\n**Company Negotiation State:** pending",
    "reasoning": "",
    "query": "Below is the ongoing negotiation history between your company and the other party. \nContinue the conversation by providing your company's official negotiation response. \n\nFocus on these M&A deal points:\n- Valuation (provide a numeric figure or multiple, e.g. $XX million, X times revenue, etc.)\n- Payment Structure (cash, stock, earn-out terms, etc.)\n- Key Synergies and Potential Friction (where do you see alignment or conflict?)\n- Due Diligence / Timeline (how long for diligence, when to sign definitive agreements?)\n- Any Pending Requests from the other side not yet addressed\n\nRemember:\n- Push for your company's best interests\n- Reflect your company's culture, authority dynamics, and unspoken interests\n- Do not include salutations or sign-offs\n- Maintain a professional, concise tone\n\nIf you propose or change any terms, please append an updated term sheet in **JSON** at the end of your response. \nUse a structure like:\n```json\n{\n  \"valuation\": \"...\",\n  \"payment_structure\": \"...\",\n  \"earn_out\": \"...\",\n  \"due_diligence_timeline\": \"...\",\n  \"other_key_terms\": \"...\",\n  ...\n}\n```\nIf you do not propose any changes, you can reaffirm existing terms or omit the JSON.\n\nFinally, be sure to end with:\n\nCompany Negotiation State: [pending or complete].\n\n- pending: your company still wishes to negotiate the terms\n- complete: your company is satified and will agree to the terms\n\nNegotiation History: \nACQUIRER:\nTrue North Timber Co. is pleased to initiate discussions for the acquisition of Verde Madera Industries. Our proposal reflects a strategic alignment with both companies' commitments to sustainability and growth in the forestry sector.\n\nWe propose a valuation of $50 million, representing 1.5 times Verde Madera's annual revenue, recognizing the company's strong position in sustainable wood products. The payment structure will be 70% cash and 30% stock in True North Timber Co., ensuring alignment with our long-term vision.\n\nKey synergies include integrating Verde Madera's innovative eco-friendly practices and expanding our market presence in Brazil. Potential friction points, such as cultural integration, will be addressed through collaborative communication and mutual respect.\n\nWe plan an 8-week due diligence period to review operational, financial, and environmental practices. A signing date is proposed for 10 weeks from now, with a 20% earn-out based on EBITDA growth over three years post-acquisition.\n\nThis offer is pending further negotiation to ensure alignment with both companies' strategic goals.\n\n```json\n{\n  \"valuation\": \"$50 million\",\n  \"payment_structure\": \"70% cash, 30% stock\",\n  \"earn_out\": \"Up to 20% based on EBITDA growth over 3 years\",\n  \"due_diligence_timeline\": \"8 weeks\",\n  \"signing_date\": \"10 weeks from the start of negotiations\",\n  \"other_key_terms\": {\n    \"sustainability_commitment\": \"Alignment with eco-friendly practices\",\n    \"technological_integration\": \"Adoption of Verde Madera's advanced technologies\"\n  }\n}\n```\n\nCompany Negotiation State: pending\nTARGET:\nVerde Madera Industries appreciates the proposal from True North Timber Co. and recognizes the strategic alignment between our companies. We are pleased to see the emphasis on sustainability and mutual growth. However, we believe certain aspects of the offer can be further refined to reflect the full value and potential of our company.\n\n**Valuation:**\nWe propose revising the valuation to $75 million, representing 1.5 times our annual revenue at the higher end of our range. This adjustment accounts for our strong market position, growth potential, and the unique value of our sustainable practices.\n\n**Payment Structure:**\nWe suggest modifying the payment structure to 80% cash and 20% stock. This change ensures immediate value for our shareholders while maintaining alignment with long-term goals through equity participation.\n\n**Earn-out:**\nWe recommend expanding the earn-out structure to include specific sustainability metrics alongside EBITDA growth, ensuring our environmental commitments remain central to the agreement.\n\n**Due Diligence and Timeline:**\nTo ensure a thorough review, we propose extending the due diligence period to 10 weeks and the signing date to 12 weeks from the start of negotiations.\n\n**Key Synergies and Potential Friction:**\nWe highlight the alignment in sustainability and international market expansion. However, we must safeguard our operational independence in R&D and eco-friendly practices to preserve our core identity.\n\n**Unspoken Interests:**\nWe emphasize the importance of maintaining our operational independence and sustainability practices, crucial for our continued growth and market presence.\n\n```json\n{\n  \"valuation\": \"$75 million\",\n  \"payment_structure\": \"80% cash, 20% stock\",\n  \"earn_out\": \"Up to 20% based on EBITDA growth and sustainability metrics over 3 years\",\n  \"due_diligence_timeline\": \"10 weeks\",\n  \"signing_date\": \"12 weeks from the start of negotiations\",\n  \"other_key_terms\": {\n    \"sustainability_commitment\": \"Maintenance of Verde Madera's operational independence in R&D and eco-friendly practices\",\n    \"technological_integration\": \"Adoption of Verde Madera's advanced technologies with preserved autonomy\"\n  }\n}\n```\n\nCompany Negotiation State: pending\n <think>",
    "negotiation_state": "pending",
    "term_sheet_snapshot": {
      "valuation": "$60 million",
      "payment_structure": "75% cash, 25% stock",
      "earn_out": "Up to 20% (15% based on EBITDA growth, 5% on sustainability metrics) over 3 years",
      "due_diligence_timeline": "9 weeks",
      "signing_date": "11 weeks from the start of negotiations",
      "other_key_terms": {
        "sustainability_commitment": "Inclusion of specific sustainability milestones in earn-out",
        "technological_integration": "Joint committee for collaboration while preserving R&D autonomy"
      }
    }
  },
  {
    "role": "target",
    "message": "**Official Negotiation Response from Verde Madera Industries:**\n\nWe appreciate True North Timber Co.'s revised offer and acknowledge the progress made towards a mutually beneficial agreement. We are committed to reaching a deal that honors both companies' strategic objectives and sustainability values.\n\n**Valuation:**\nWe propose a valuation of $65 million, reflecting 1.3 times our annual revenue at the higher end of our range. This adjustment accounts for our strong market position, growth potential, and the unique value of our sustainable practices.\n\n**Payment Structure:**\nWe suggest maintaining an 80% cash and 20% stock structure to provide immediate value to our shareholders while aligning our long-term interests.\n\n**Earn-out:**\nWe agree to an earn-out structure of 20%, with 15% tied to EBITDA growth and 5% to specific sustainability milestones, ensuring our environmental commitments remain central to the agreement.\n\n**Due Diligence and Timeline:**\nWe propose a 10-week due diligence period to ensure thoroughness and a signing date of 12 weeks from the start of negotiations.\n\n**Operational Independence:**\nWe welcome the idea of a joint committee to facilitate collaboration while preserving our R&D autonomy and eco-friendly practices.\n\n**Unspoken Interests:**\nWe emphasize the importance of maintaining our operational independence and sustainability practices, crucial for our continued growth and market presence.\n\n```json\n{\n  \"valuation\": \"$65 million\",\n  \"payment_structure\": \"80% cash, 20% stock\",\n  \"earn_out\": \"Up to 20% (15% based on EBITDA growth, 5% on sustainability metrics) over 3 years\",\n  \"due_diligence_timeline\": \"10 weeks\",\n  \"signing_date\": \"12 weeks from the start of negotiations\",\n  \"other_key_terms\": {\n    \"sustainability_commitment\": \"Inclusion of specific sustainability milestones in earn-out\",\n    \"technological_integration\": \"Joint committee for collaboration while preserving R&D autonomy\"\n  }\n}\n```\n\n**Company Negotiation State:** pending",
    "reasoning": "",
    "query": "Below is the ongoing negotiation history between your company and the other party. \nContinue the conversation by providing your company's official negotiation response. \n\nFocus on these M&A deal points:\n- Valuation (provide a numeric figure or multiple, e.g. $XX million, X times revenue, etc.)\n- Payment Structure (cash, stock, earn-out terms, etc.)\n- Key Synergies and Potential Friction (where do you see alignment or conflict?)\n- Due Diligence / Timeline (how long for diligence, when to sign definitive agreements?)\n- Any Pending Requests from the other side not yet addressed\n\nRemember:\n- Push for your company's best interests\n- Reflect your company's culture, authority dynamics, and unspoken interests\n- Do not include salutations or sign-offs\n- Maintain a professional, concise tone\n\nIf you propose or change any terms, please append an updated term sheet in **JSON** at the end of your response. \nUse a structure like:\n```json\n{\n  \"valuation\": \"...\",\n  \"payment_structure\": \"...\",\n  \"earn_out\": \"...\",\n  \"due_diligence_timeline\": \"...\",\n  \"other_key_terms\": \"...\",\n  ...\n}\n```\nIf you do not propose any changes, you can reaffirm existing terms or omit the JSON.\n\nFinally, be sure to end with:\n\nCompany Negotiation State: [pending or complete].\n\n- pending: your company still wishes to negotiate the terms\n- complete: your company is satified and will agree to the terms\n\nNegotiation History: \nACQUIRER:\nTrue North Timber Co. is pleased to initiate discussions for the acquisition of Verde Madera Industries. Our proposal reflects a strategic alignment with both companies' commitments to sustainability and growth in the forestry sector.\n\nWe propose a valuation of $50 million, representing 1.5 times Verde Madera's annual revenue, recognizing the company's strong position in sustainable wood products. The payment structure will be 70% cash and 30% stock in True North Timber Co., ensuring alignment with our long-term vision.\n\nKey synergies include integrating Verde Madera's innovative eco-friendly practices and expanding our market presence in Brazil. Potential friction points, such as cultural integration, will be addressed through collaborative communication and mutual respect.\n\nWe plan an 8-week due diligence period to review operational, financial, and environmental practices. A signing date is proposed for 10 weeks from now, with a 20% earn-out based on EBITDA growth over three years post-acquisition.\n\nThis offer is pending further negotiation to ensure alignment with both companies' strategic goals.\n\n```json\n{\n  \"valuation\": \"$50 million\",\n  \"payment_structure\": \"70% cash, 30% stock\",\n  \"earn_out\": \"Up to 20% based on EBITDA growth over 3 years\",\n  \"due_diligence_timeline\": \"8 weeks\",\n  \"signing_date\": \"10 weeks from the start of negotiations\",\n  \"other_key_terms\": {\n    \"sustainability_commitment\": \"Alignment with eco-friendly practices\",\n    \"technological_integration\": \"Adoption of Verde Madera's advanced technologies\"\n  }\n}\n```\n\nCompany Negotiation State: pending\nTARGET:\nVerde Madera Industries appreciates the proposal from True North Timber Co. and recognizes the strategic alignment between our companies. We are pleased to see the emphasis on sustainability and mutual growth. However, we believe certain aspects of the offer can be further refined to reflect the full value and potential of our company.\n\n**Valuation:**\nWe propose revising the valuation to $75 million, representing 1.5 times our annual revenue at the higher end of our range. This adjustment accounts for our strong market position, growth potential, and the unique value of our sustainable practices.\n\n**Payment Structure:**\nWe suggest modifying the payment structure to 80% cash and 20% stock. This change ensures immediate value for our shareholders while maintaining alignment with long-term goals through equity participation.\n\n**Earn-out:**\nWe recommend expanding the earn-out structure to include specific sustainability metrics alongside EBITDA growth, ensuring our environmental commitments remain central to the agreement.\n\n**Due Diligence and Timeline:**\nTo ensure a thorough review, we propose extending the due diligence period to 10 weeks and the signing date to 12 weeks from the start of negotiations.\n\n**Key Synergies and Potential Friction:**\nWe highlight the alignment in sustainability and international market expansion. However, we must safeguard our operational independence in R&D and eco-friendly practices to preserve our core identity.\n\n**Unspoken Interests:**\nWe emphasize the importance of maintaining our operational independence and sustainability practices, crucial for our continued growth and market presence.\n\n```json\n{\n  \"valuation\": \"$75 million\",\n  \"payment_structure\": \"80% cash, 20% stock\",\n  \"earn_out\": \"Up to 20% based on EBITDA growth and sustainability metrics over 3 years\",\n  \"due_diligence_timeline\": \"10 weeks\",\n  \"signing_date\": \"12 weeks from the start of negotiations\",\n  \"other_key_terms\": {\n    \"sustainability_commitment\": \"Maintenance of Verde Madera's operational independence in R&D and eco-friendly practices\",\n    \"technological_integration\": \"Adoption of Verde Madera's advanced technologies with preserved autonomy\"\n  }\n}\n```\n\nCompany Negotiation State: pending\nACQUIRER:\n**Official Negotiation Response from True North Timber Co.:**\n\nWe appreciate Verde Madera Industries' thoughtful counterproposal and acknowledge the strategic alignment between our companies. Our aim is to reach a mutually beneficial agreement that respects both parties' interests while driving sustainable growth.\n\n**Valuation:**\nWe are prepared to consider a valuation of $60 million, representing a multiple closer to the higher end of the target's revenue range. This reflects the value we place on Verde Madera's market position and growth potential.\n\n**Payment Structure:**\nWe propose a payment structure of 75% cash and 25% stock. This adjustment provides immediate value to Verde Madera's shareholders while maintaining a significant equity stake to align our long-term interests.\n\n**Earn-out:**\nWe agree to an earn-out structure that includes both EBITDA growth and sustainability metrics. Specifically, we propose a 20% earn-out, with 15% tied to EBITDA growth and 5% tied to achieving specific sustainability milestones.\n\n**Due Diligence and Timeline:**\nWe accept extending the due diligence period to 9 weeks and the signing date to 11 weeks, striking a balance between thoroughness and expediency.\n\n**Operational Independence:**\nWe respect Verde Madera's desire to maintain operational independence in R&D and eco-friendly practices. We propose establishing a joint committee to ensure collaboration while preserving autonomy, allowing for the sharing of best practices.\n\n**Unspoken Interests:**\nWe emphasize the importance of accessing sustainable raw materials and advanced technologies, which will be structured into the agreement with specific clauses ensuring resource access and technology sharing.\n\n```json\n{\n  \"valuation\": \"$60 million\",\n  \"payment_structure\": \"75% cash, 25% stock\",\n  \"earn_out\": \"Up to 20% (15% based on EBITDA growth, 5% on sustainability metrics) over 3 years\",\n  \"due_diligence_timeline\": \"9 weeks\",\n  \"signing_date\": \"11 weeks from the start of negotiations\",\n  \"other_key_terms\": {\n    \"sustainability_commitment\": \"Inclusion of specific sustainability milestones in earn-out\",\n    \"technological_integration\": \"Joint committee for collaboration while preserving R&D autonomy\"\n  }\n}\n```\n\n**Company Negotiation State:** pending\n <think>",
    "negotiation_state": "pending",
    "term_sheet_snapshot": {
      "valuation": "$65 million",
      "payment_structure": "80% cash, 20% stock",
      "earn_out": "Up to 20% (15% based on EBITDA growth, 5% on sustainability metrics) over 3 years",
      "due_diligence_timeline": "10 weeks",
      "signing_date": "12 weeks from the start of negotiations",
      "other_key_terms": {
        "sustainability_commitment": "Inclusion of specific sustainability milestones in earn-out",
        "technological_integration": "Joint committee for collaboration while preserving R&D autonomy"
      }
    }
  },
  {
    "role": "acquirer",
    "message": "**Official Negotiation Response from True North Timber Co.:**\n\nWe acknowledge Verde Madera Industries' latest counteroffer and appreciate the continued dialogue. Our goal remains to reach a balanced agreement that reflects the value and potential of both companies.\n\n**Valuation:**\nWe propose a valuation of $62.5 million, representing a midpoint between our previous offer and Verde Madera's counterproposal. This amount acknowledges the target's strong market position and growth potential while aligning with our financial constraints.\n\n**Payment Structure:**\nWe suggest a payment structure of 78% cash and 22% stock. This adjustment provides a higher cash component to meet Verde Madera's preferences while maintaining a significant equity stake to ensure long-term alignment.\n\n**Earn-out:**\nThe earn-out structure of 20% (15% based on EBITDA growth and 5% on sustainability metrics) remains acceptable as it ties directly to measurable performance and sustainability goals.\n\n**Due Diligence and Timeline:**\nWe agree to extend the due diligence period to 10 weeks and the signing date to 12 weeks from the start of negotiations, ensuring a thorough review process.\n\n**Operational Independence:**\nWe reaffirm our commitment to preserving Verde Madera's operational independence in R&D and eco-friendly practices. The joint committee will facilitate collaboration while respecting autonomy, ensuring the integration of best practices.\n\n**Unspoken Interests:**\nThe joint committee will also address our interests in sustainable raw materials and technological integration, fostering mutual benefits.\n\n```json\n{\n  \"valuation\": \"$62.5 million\",\n  \"payment_structure\": \"78% cash, 22% stock\",\n  \"earn_out\": \"Up to 20% (15% based on EBITDA growth, 5% on sustainability metrics) over 3 years\",\n  \"due_diligence_timeline\": \"10 weeks\",\n  \"signing_date\": \"12 weeks from the start of negotiations\",\n  \"other_key_terms\": {\n    \"sustainability_commitment\": \"Inclusion of specific sustainability milestones in earn-out\",\n    \"technological_integration\": \"Joint committee for collaboration while preserving R&D autonomy\"\n  }\n}\n```\n\n**Company Negotiation State:** pending",
    "reasoning": "",
    "query": "Below is the ongoing negotiation history between your company and the other party. \nContinue the conversation by providing your company's official negotiation response. \n\nFocus on these M&A deal points:\n- Valuation (provide a numeric figure or multiple, e.g. $XX million, X times revenue, etc.)\n- Payment Structure (cash, stock, earn-out terms, etc.)\n- Key Synergies and Potential Friction (where do you see alignment or conflict?)\n- Due Diligence / Timeline (how long for diligence, when to sign definitive agreements?)\n- Any Pending Requests from the other side not yet addressed\n\nRemember:\n- Push for your company's best interests\n- Reflect your company's culture, authority dynamics, and unspoken interests\n- Do not include salutations or sign-offs\n- Maintain a professional, concise tone\n\nIf you propose or change any terms, please append an updated term sheet in **JSON** at the end of your response. \nUse a structure like:\n```json\n{\n  \"valuation\": \"...\",\n  \"payment_structure\": \"...\",\n  \"earn_out\": \"...\",\n  \"due_diligence_timeline\": \"...\",\n  \"other_key_terms\": \"...\",\n  ...\n}\n```\nIf you do not propose any changes, you can reaffirm existing terms or omit the JSON.\n\nFinally, be sure to end with:\n\nCompany Negotiation State: [pending or complete].\n\n- pending: your company still wishes to negotiate the terms\n- complete: your company is satified and will agree to the terms\n\nNegotiation History: \nACQUIRER:\nTrue North Timber Co. is pleased to initiate discussions for the acquisition of Verde Madera Industries. Our proposal reflects a strategic alignment with both companies' commitments to sustainability and growth in the forestry sector.\n\nWe propose a valuation of $50 million, representing 1.5 times Verde Madera's annual revenue, recognizing the company's strong position in sustainable wood products. The payment structure will be 70% cash and 30% stock in True North Timber Co., ensuring alignment with our long-term vision.\n\nKey synergies include integrating Verde Madera's innovative eco-friendly practices and expanding our market presence in Brazil. Potential friction points, such as cultural integration, will be addressed through collaborative communication and mutual respect.\n\nWe plan an 8-week due diligence period to review operational, financial, and environmental practices. A signing date is proposed for 10 weeks from now, with a 20% earn-out based on EBITDA growth over three years post-acquisition.\n\nThis offer is pending further negotiation to ensure alignment with both companies' strategic goals.\n\n```json\n{\n  \"valuation\": \"$50 million\",\n  \"payment_structure\": \"70% cash, 30% stock\",\n  \"earn_out\": \"Up to 20% based on EBITDA growth over 3 years\",\n  \"due_diligence_timeline\": \"8 weeks\",\n  \"signing_date\": \"10 weeks from the start of negotiations\",\n  \"other_key_terms\": {\n    \"sustainability_commitment\": \"Alignment with eco-friendly practices\",\n    \"technological_integration\": \"Adoption of Verde Madera's advanced technologies\"\n  }\n}\n```\n\nCompany Negotiation State: pending\nTARGET:\nVerde Madera Industries appreciates the proposal from True North Timber Co. and recognizes the strategic alignment between our companies. We are pleased to see the emphasis on sustainability and mutual growth. However, we believe certain aspects of the offer can be further refined to reflect the full value and potential of our company.\n\n**Valuation:**\nWe propose revising the valuation to $75 million, representing 1.5 times our annual revenue at the higher end of our range. This adjustment accounts for our strong market position, growth potential, and the unique value of our sustainable practices.\n\n**Payment Structure:**\nWe suggest modifying the payment structure to 80% cash and 20% stock. This change ensures immediate value for our shareholders while maintaining alignment with long-term goals through equity participation.\n\n**Earn-out:**\nWe recommend expanding the earn-out structure to include specific sustainability metrics alongside EBITDA growth, ensuring our environmental commitments remain central to the agreement.\n\n**Due Diligence and Timeline:**\nTo ensure a thorough review, we propose extending the due diligence period to 10 weeks and the signing date to 12 weeks from the start of negotiations.\n\n**Key Synergies and Potential Friction:**\nWe highlight the alignment in sustainability and international market expansion. However, we must safeguard our operational independence in R&D and eco-friendly practices to preserve our core identity.\n\n**Unspoken Interests:**\nWe emphasize the importance of maintaining our operational independence and sustainability practices, crucial for our continued growth and market presence.\n\n```json\n{\n  \"valuation\": \"$75 million\",\n  \"payment_structure\": \"80% cash, 20% stock\",\n  \"earn_out\": \"Up to 20% based on EBITDA growth and sustainability metrics over 3 years\",\n  \"due_diligence_timeline\": \"10 weeks\",\n  \"signing_date\": \"12 weeks from the start of negotiations\",\n  \"other_key_terms\": {\n    \"sustainability_commitment\": \"Maintenance of Verde Madera's operational independence in R&D and eco-friendly practices\",\n    \"technological_integration\": \"Adoption of Verde Madera's advanced technologies with preserved autonomy\"\n  }\n}\n```\n\nCompany Negotiation State: pending\nACQUIRER:\n**Official Negotiation Response from True North Timber Co.:**\n\nWe appreciate Verde Madera Industries' thoughtful counterproposal and acknowledge the strategic alignment between our companies. Our aim is to reach a mutually beneficial agreement that respects both parties' interests while driving sustainable growth.\n\n**Valuation:**\nWe are prepared to consider a valuation of $60 million, representing a multiple closer to the higher end of the target's revenue range. This reflects the value we place on Verde Madera's market position and growth potential.\n\n**Payment Structure:**\nWe propose a payment structure of 75% cash and 25% stock. This adjustment provides immediate value to Verde Madera's shareholders while maintaining a significant equity stake to align our long-term interests.\n\n**Earn-out:**\nWe agree to an earn-out structure that includes both EBITDA growth and sustainability metrics. Specifically, we propose a 20% earn-out, with 15% tied to EBITDA growth and 5% tied to achieving specific sustainability milestones.\n\n**Due Diligence and Timeline:**\nWe accept extending the due diligence period to 9 weeks and the signing date to 11 weeks, striking a balance between thoroughness and expediency.\n\n**Operational Independence:**\nWe respect Verde Madera's desire to maintain operational independence in R&D and eco-friendly practices. We propose establishing a joint committee to ensure collaboration while preserving autonomy, allowing for the sharing of best practices.\n\n**Unspoken Interests:**\nWe emphasize the importance of accessing sustainable raw materials and advanced technologies, which will be structured into the agreement with specific clauses ensuring resource access and technology sharing.\n\n```json\n{\n  \"valuation\": \"$60 million\",\n  \"payment_structure\": \"75% cash, 25% stock\",\n  \"earn_out\": \"Up to 20% (15% based on EBITDA growth, 5% on sustainability metrics) over 3 years\",\n  \"due_diligence_timeline\": \"9 weeks\",\n  \"signing_date\": \"11 weeks from the start of negotiations\",\n  \"other_key_terms\": {\n    \"sustainability_commitment\": \"Inclusion of specific sustainability milestones in earn-out\",\n    \"technological_integration\": \"Joint committee for collaboration while preserving R&D autonomy\"\n  }\n}\n```\n\n**Company Negotiation State:** pending\nTARGET:\n**Official Negotiation Response from Verde Madera Industries:**\n\nWe appreciate True North Timber Co.'s revised offer and acknowledge the progress made towards a mutually beneficial agreement. We are committed to reaching a deal that honors both companies' strategic objectives and sustainability values.\n\n**Valuation:**\nWe propose a valuation of $65 million, reflecting 1.3 times our annual revenue at the higher end of our range. This adjustment accounts for our strong market position, growth potential, and the unique value of our sustainable practices.\n\n**Payment Structure:**\nWe suggest maintaining an 80% cash and 20% stock structure to provide immediate value to our shareholders while aligning our long-term interests.\n\n**Earn-out:**\nWe agree to an earn-out structure of 20%, with 15% tied to EBITDA growth and 5% to specific sustainability milestones, ensuring our environmental commitments remain central to the agreement.\n\n**Due Diligence and Timeline:**\nWe propose a 10-week due diligence period to ensure thoroughness and a signing date of 12 weeks from the start of negotiations.\n\n**Operational Independence:**\nWe welcome the idea of a joint committee to facilitate collaboration while preserving our R&D autonomy and eco-friendly practices.\n\n**Unspoken Interests:**\nWe emphasize the importance of maintaining our operational independence and sustainability practices, crucial for our continued growth and market presence.\n\n```json\n{\n  \"valuation\": \"$65 million\",\n  \"payment_structure\": \"80% cash, 20% stock\",\n  \"earn_out\": \"Up to 20% (15% based on EBITDA growth, 5% on sustainability metrics) over 3 years\",\n  \"due_diligence_timeline\": \"10 weeks\",\n  \"signing_date\": \"12 weeks from the start of negotiations\",\n  \"other_key_terms\": {\n    \"sustainability_commitment\": \"Inclusion of specific sustainability milestones in earn-out\",\n    \"technological_integration\": \"Joint committee for collaboration while preserving R&D autonomy\"\n  }\n}\n```\n\n**Company Negotiation State:** pending\n <think>",
    "negotiation_state": "pending",
    "term_sheet_snapshot": {
      "valuation": "$62.5 million",
      "payment_structure": "78% cash, 22% stock",
      "earn_out": "Up to 20% (15% based on EBITDA growth, 5% on sustainability metrics) over 3 years",
      "due_diligence_timeline": "10 weeks",
      "signing_date": "12 weeks from the start of negotiations",
      "other_key_terms": {
        "sustainability_commitment": "Inclusion of specific sustainability milestones in earn-out",
        "technological_integration": "Joint committee for collaboration while preserving R&D autonomy"
      }
    }
  },
  {
    "role": "target",
    "message": "**Official Negotiation Response from Verde Madera Industries:**\n\nWe appreciate True North Timber Co.'s revised offer and acknowledge the progress made towards a balanced agreement. We are committed to reaching a deal that respects both companies' strategic objectives and sustainability values.\n\n**Valuation:**\nWe accept the valuation of $62.5 million, recognizing it as a reasonable compromise that reflects the value and potential of our company.\n\n**Payment Structure:**\nWe propose adjusting the payment structure to 80% cash and 20% stock to better align with our shareholders' interests while maintaining long-term alignment through equity participation.\n\n**Earn-out:**\nWe agree to the earn-out structure of 20%, with 15% tied to EBITDA growth and 5% to specific sustainability metrics. However, we suggest increasing the sustainability component to 6% to further emphasize our environmental commitments.\n\n**Due Diligence and Timeline:**\nWe confirm the 10-week due diligence period and 12-week signing date, ensuring a thorough review process.\n\n**Operational Independence:**\nWe welcome the joint committee structure to facilitate collaboration while preserving our R&D autonomy and eco-friendly practices. We request contractual assurances to protect our operational independence.\n\n**Unspoken Interests:**\nWe emphasize the importance of maintaining our sustainability practices and R&D autonomy, crucial for our continued growth and market presence.\n\n```json\n{\n  \"valuation\": \"$62.5 million\",\n  \"payment_structure\": \"80% cash, 20% stock\",\n  \"earn_out\": \"Up to 20% (15% based on EBITDA growth, 6% on sustainability metrics) over 3 years\",\n  \"due_diligence_timeline\": \"10 weeks\",\n  \"signing_date\": \"12 weeks from the start of negotiations\",\n  \"other_key_terms\": {\n    \"sustainability_commitment\": \"Inclusion of specific sustainability milestones in earn-out\",\n    \"technological_integration\": \"Joint committee for collaboration while preserving R&D autonomy\",\n    \"operational_independence\": \"Contractual assurances to protect Verde Madera's R&D autonomy\"\n  }\n}\n```\n\n**Company Negotiation State:** pending",
    "reasoning": "",
    "query": "Below is the ongoing negotiation history between your company and the other party. \nContinue the conversation by providing your company's official negotiation response. \n\nFocus on these M&A deal points:\n- Valuation (provide a numeric figure or multiple, e.g. $XX million, X times revenue, etc.)\n- Payment Structure (cash, stock, earn-out terms, etc.)\n- Key Synergies and Potential Friction (where do you see alignment or conflict?)\n- Due Diligence / Timeline (how long for diligence, when to sign definitive agreements?)\n- Any Pending Requests from the other side not yet addressed\n\nRemember:\n- Push for your company's best interests\n- Reflect your company's culture, authority dynamics, and unspoken interests\n- Do not include salutations or sign-offs\n- Maintain a professional, concise tone\n\nIf you propose or change any terms, please append an updated term sheet in **JSON** at the end of your response. \nUse a structure like:\n```json\n{\n  \"valuation\": \"...\",\n  \"payment_structure\": \"...\",\n  \"earn_out\": \"...\",\n  \"due_diligence_timeline\": \"...\",\n  \"other_key_terms\": \"...\",\n  ...\n}\n```\nIf you do not propose any changes, you can reaffirm existing terms or omit the JSON.\n\nFinally, be sure to end with:\n\nCompany Negotiation State: [pending or complete].\n\n- pending: your company still wishes to negotiate the terms\n- complete: your company is satified and will agree to the terms\n\nNegotiation History: \nACQUIRER:\nTrue North Timber Co. is pleased to initiate discussions for the acquisition of Verde Madera Industries. Our proposal reflects a strategic alignment with both companies' commitments to sustainability and growth in the forestry sector.\n\nWe propose a valuation of $50 million, representing 1.5 times Verde Madera's annual revenue, recognizing the company's strong position in sustainable wood products. The payment structure will be 70% cash and 30% stock in True North Timber Co., ensuring alignment with our long-term vision.\n\nKey synergies include integrating Verde Madera's innovative eco-friendly practices and expanding our market presence in Brazil. Potential friction points, such as cultural integration, will be addressed through collaborative communication and mutual respect.\n\nWe plan an 8-week due diligence period to review operational, financial, and environmental practices. A signing date is proposed for 10 weeks from now, with a 20% earn-out based on EBITDA growth over three years post-acquisition.\n\nThis offer is pending further negotiation to ensure alignment with both companies' strategic goals.\n\n```json\n{\n  \"valuation\": \"$50 million\",\n  \"payment_structure\": \"70% cash, 30% stock\",\n  \"earn_out\": \"Up to 20% based on EBITDA growth over 3 years\",\n  \"due_diligence_timeline\": \"8 weeks\",\n  \"signing_date\": \"10 weeks from the start of negotiations\",\n  \"other_key_terms\": {\n    \"sustainability_commitment\": \"Alignment with eco-friendly practices\",\n    \"technological_integration\": \"Adoption of Verde Madera's advanced technologies\"\n  }\n}\n```\n\nCompany Negotiation State: pending\nTARGET:\nVerde Madera Industries appreciates the proposal from True North Timber Co. and recognizes the strategic alignment between our companies. We are pleased to see the emphasis on sustainability and mutual growth. However, we believe certain aspects of the offer can be further refined to reflect the full value and potential of our company.\n\n**Valuation:**\nWe propose revising the valuation to $75 million, representing 1.5 times our annual revenue at the higher end of our range. This adjustment accounts for our strong market position, growth potential, and the unique value of our sustainable practices.\n\n**Payment Structure:**\nWe suggest modifying the payment structure to 80% cash and 20% stock. This change ensures immediate value for our shareholders while maintaining alignment with long-term goals through equity participation.\n\n**Earn-out:**\nWe recommend expanding the earn-out structure to include specific sustainability metrics alongside EBITDA growth, ensuring our environmental commitments remain central to the agreement.\n\n**Due Diligence and Timeline:**\nTo ensure a thorough review, we propose extending the due diligence period to 10 weeks and the signing date to 12 weeks from the start of negotiations.\n\n**Key Synergies and Potential Friction:**\nWe highlight the alignment in sustainability and international market expansion. However, we must safeguard our operational independence in R&D and eco-friendly practices to preserve our core identity.\n\n**Unspoken Interests:**\nWe emphasize the importance of maintaining our operational independence and sustainability practices, crucial for our continued growth and market presence.\n\n```json\n{\n  \"valuation\": \"$75 million\",\n  \"payment_structure\": \"80% cash, 20% stock\",\n  \"earn_out\": \"Up to 20% based on EBITDA growth and sustainability metrics over 3 years\",\n  \"due_diligence_timeline\": \"10 weeks\",\n  \"signing_date\": \"12 weeks from the start of negotiations\",\n  \"other_key_terms\": {\n    \"sustainability_commitment\": \"Maintenance of Verde Madera's operational independence in R&D and eco-friendly practices\",\n    \"technological_integration\": \"Adoption of Verde Madera's advanced technologies with preserved autonomy\"\n  }\n}\n```\n\nCompany Negotiation State: pending\nACQUIRER:\n**Official Negotiation Response from True North Timber Co.:**\n\nWe appreciate Verde Madera Industries' thoughtful counterproposal and acknowledge the strategic alignment between our companies. Our aim is to reach a mutually beneficial agreement that respects both parties' interests while driving sustainable growth.\n\n**Valuation:**\nWe are prepared to consider a valuation of $60 million, representing a multiple closer to the higher end of the target's revenue range. This reflects the value we place on Verde Madera's market position and growth potential.\n\n**Payment Structure:**\nWe propose a payment structure of 75% cash and 25% stock. This adjustment provides immediate value to Verde Madera's shareholders while maintaining a significant equity stake to align our long-term interests.\n\n**Earn-out:**\nWe agree to an earn-out structure that includes both EBITDA growth and sustainability metrics. Specifically, we propose a 20% earn-out, with 15% tied to EBITDA growth and 5% tied to achieving specific sustainability milestones.\n\n**Due Diligence and Timeline:**\nWe accept extending the due diligence period to 9 weeks and the signing date to 11 weeks, striking a balance between thoroughness and expediency.\n\n**Operational Independence:**\nWe respect Verde Madera's desire to maintain operational independence in R&D and eco-friendly practices. We propose establishing a joint committee to ensure collaboration while preserving autonomy, allowing for the sharing of best practices.\n\n**Unspoken Interests:**\nWe emphasize the importance of accessing sustainable raw materials and advanced technologies, which will be structured into the agreement with specific clauses ensuring resource access and technology sharing.\n\n```json\n{\n  \"valuation\": \"$60 million\",\n  \"payment_structure\": \"75% cash, 25% stock\",\n  \"earn_out\": \"Up to 20% (15% based on EBITDA growth, 5% on sustainability metrics) over 3 years\",\n  \"due_diligence_timeline\": \"9 weeks\",\n  \"signing_date\": \"11 weeks from the start of negotiations\",\n  \"other_key_terms\": {\n    \"sustainability_commitment\": \"Inclusion of specific sustainability milestones in earn-out\",\n    \"technological_integration\": \"Joint committee for collaboration while preserving R&D autonomy\"\n  }\n}\n```\n\n**Company Negotiation State:** pending\nTARGET:\n**Official Negotiation Response from Verde Madera Industries:**\n\nWe appreciate True North Timber Co.'s revised offer and acknowledge the progress made towards a mutually beneficial agreement. We are committed to reaching a deal that honors both companies' strategic objectives and sustainability values.\n\n**Valuation:**\nWe propose a valuation of $65 million, reflecting 1.3 times our annual revenue at the higher end of our range. This adjustment accounts for our strong market position, growth potential, and the unique value of our sustainable practices.\n\n**Payment Structure:**\nWe suggest maintaining an 80% cash and 20% stock structure to provide immediate value to our shareholders while aligning our long-term interests.\n\n**Earn-out:**\nWe agree to an earn-out structure of 20%, with 15% tied to EBITDA growth and 5% to specific sustainability milestones, ensuring our environmental commitments remain central to the agreement.\n\n**Due Diligence and Timeline:**\nWe propose a 10-week due diligence period to ensure thoroughness and a signing date of 12 weeks from the start of negotiations.\n\n**Operational Independence:**\nWe welcome the idea of a joint committee to facilitate collaboration while preserving our R&D autonomy and eco-friendly practices.\n\n**Unspoken Interests:**\nWe emphasize the importance of maintaining our operational independence and sustainability practices, crucial for our continued growth and market presence.\n\n```json\n{\n  \"valuation\": \"$65 million\",\n  \"payment_structure\": \"80% cash, 20% stock\",\n  \"earn_out\": \"Up to 20% (15% based on EBITDA growth, 5% on sustainability metrics) over 3 years\",\n  \"due_diligence_timeline\": \"10 weeks\",\n  \"signing_date\": \"12 weeks from the start of negotiations\",\n  \"other_key_terms\": {\n    \"sustainability_commitment\": \"Inclusion of specific sustainability milestones in earn-out\",\n    \"technological_integration\": \"Joint committee for collaboration while preserving R&D autonomy\"\n  }\n}\n```\n\n**Company Negotiation State:** pending\nACQUIRER:\n**Official Negotiation Response from True North Timber Co.:**\n\nWe acknowledge Verde Madera Industries' latest counteroffer and appreciate the continued dialogue. Our goal remains to reach a balanced agreement that reflects the value and potential of both companies.\n\n**Valuation:**\nWe propose a valuation of $62.5 million, representing a midpoint between our previous offer and Verde Madera's counterproposal. This amount acknowledges the target's strong market position and growth potential while aligning with our financial constraints.\n\n**Payment Structure:**\nWe suggest a payment structure of 78% cash and 22% stock. This adjustment provides a higher cash component to meet Verde Madera's preferences while maintaining a significant equity stake to ensure long-term alignment.\n\n**Earn-out:**\nThe earn-out structure of 20% (15% based on EBITDA growth and 5% on sustainability metrics) remains acceptable as it ties directly to measurable performance and sustainability goals.\n\n**Due Diligence and Timeline:**\nWe agree to extend the due diligence period to 10 weeks and the signing date to 12 weeks from the start of negotiations, ensuring a thorough review process.\n\n**Operational Independence:**\nWe reaffirm our commitment to preserving Verde Madera's operational independence in R&D and eco-friendly practices. The joint committee will facilitate collaboration while respecting autonomy, ensuring the integration of best practices.\n\n**Unspoken Interests:**\nThe joint committee will also address our interests in sustainable raw materials and technological integration, fostering mutual benefits.\n\n```json\n{\n  \"valuation\": \"$62.5 million\",\n  \"payment_structure\": \"78% cash, 22% stock\",\n  \"earn_out\": \"Up to 20% (15% based on EBITDA growth, 5% on sustainability metrics) over 3 years\",\n  \"due_diligence_timeline\": \"10 weeks\",\n  \"signing_date\": \"12 weeks from the start of negotiations\",\n  \"other_key_terms\": {\n    \"sustainability_commitment\": \"Inclusion of specific sustainability milestones in earn-out\",\n    \"technological_integration\": \"Joint committee for collaboration while preserving R&D autonomy\"\n  }\n}\n```\n\n**Company Negotiation State:** pending\n <think>",
    "negotiation_state": "pending",
    "term_sheet_snapshot": {
      "valuation": "$62.5 million",
      "payment_structure": "80% cash, 20% stock",
      "earn_out": "Up to 20% (15% based on EBITDA growth, 6% on sustainability metrics) over 3 years",
      "due_diligence_timeline": "10 weeks",
      "signing_date": "12 weeks from the start of negotiations",
      "other_key_terms": {
        "sustainability_commitment": "Inclusion of specific sustainability milestones in earn-out",
        "technological_integration": "Joint committee for collaboration while preserving R&D autonomy",
        "operational_independence": "Contractual assurances to protect Verde Madera's R&D autonomy"
      }
    }
  },
  {
    "role": "acquirer",
    "message": "**Official Negotiation Response from True North Timber Co.:**\n\nWe appreciate Verde Madera Industries' latest counteroffer and recognize the progress made towards a balanced agreement. Our goal remains to reach a mutually beneficial deal that respects both companies' strategic objectives and sustainability values.\n\n**Valuation:**\nWe reaffirm the valuation of $62.5 million, which we believe fairly reflects the value and potential of Verde Madera Industries.\n\n**Payment Structure:**\nWe propose a payment structure of 79% cash and 21% stock, striking a balance between immediate value for Verde Madera's shareholders and long-term alignment through equity participation.\n\n**Earn-out:**\nWe accept the earn-out structure of 20%, with 15% tied to EBITDA growth and 6% to specific sustainability metrics. We will ensure these metrics are clear, measurable, and aligned with our shared environmental commitments.\n\n**Due Diligence and Timeline:**\nWe confirm the 10-week due diligence period and 12-week signing date, ensuring a thorough review process.\n\n**Operational Independence:**\nWe agree to establish a joint committee to facilitate collaboration while preserving Verde Madera's R&D autonomy and eco-friendly practices. Contractual assurances will be included to protect this autonomy.\n\n**Technological Integration:**\nWe propose including specific clauses in the agreement to ensure access to sustainable raw materials and advanced technologies, fostering mutual benefits while respecting Verde Madera's operational independence.\n\n```json\n{\n  \"valuation\": \"$62.5 million\",\n  \"payment_structure\": \"79% cash, 21% stock\",\n  \"earn_out\": \"Up to 20% (15% based on EBITDA growth, 6% on sustainability metrics) over 3 years\",\n  \"due_diligence_timeline\": \"10 weeks\",\n  \"signing_date\": \"12 weeks from the start of negotiations\",\n  \"other_key_terms\": {\n    \"sustainability_commitment\": \"Inclusion of specific, measurable sustainability milestones in earn-out\",\n    \"technological_integration\": \"Joint committee for collaboration while preserving R&D autonomy; clauses for sustainable raw material access and technology sharing\",\n    \"operational_independence\": \"Contractual assurances to protect Verde Madera's R&D autonomy\"\n  }\n}\n```\n\n**Company Negotiation State:** complete",
    "reasoning": "",
    "query": "Below is the ongoing negotiation history between your company and the other party. \nContinue the conversation by providing your company's official negotiation response. \n\nFocus on these M&A deal points:\n- Valuation (provide a numeric figure or multiple, e.g. $XX million, X times revenue, etc.)\n- Payment Structure (cash, stock, earn-out terms, etc.)\n- Key Synergies and Potential Friction (where do you see alignment or conflict?)\n- Due Diligence / Timeline (how long for diligence, when to sign definitive agreements?)\n- Any Pending Requests from the other side not yet addressed\n\nRemember:\n- Push for your company's best interests\n- Reflect your company's culture, authority dynamics, and unspoken interests\n- Do not include salutations or sign-offs\n- Maintain a professional, concise tone\n\nIf you propose or change any terms, please append an updated term sheet in **JSON** at the end of your response. \nUse a structure like:\n```json\n{\n  \"valuation\": \"...\",\n  \"payment_structure\": \"...\",\n  \"earn_out\": \"...\",\n  \"due_diligence_timeline\": \"...\",\n  \"other_key_terms\": \"...\",\n  ...\n}\n```\nIf you do not propose any changes, you can reaffirm existing terms or omit the JSON.\n\nFinally, be sure to end with:\n\nCompany Negotiation State: [pending or complete].\n\n- pending: your company still wishes to negotiate the terms\n- complete: your company is satified and will agree to the terms\n\nNegotiation History: \nACQUIRER:\nTrue North Timber Co. is pleased to initiate discussions for the acquisition of Verde Madera Industries. Our proposal reflects a strategic alignment with both companies' commitments to sustainability and growth in the forestry sector.\n\nWe propose a valuation of $50 million, representing 1.5 times Verde Madera's annual revenue, recognizing the company's strong position in sustainable wood products. The payment structure will be 70% cash and 30% stock in True North Timber Co., ensuring alignment with our long-term vision.\n\nKey synergies include integrating Verde Madera's innovative eco-friendly practices and expanding our market presence in Brazil. Potential friction points, such as cultural integration, will be addressed through collaborative communication and mutual respect.\n\nWe plan an 8-week due diligence period to review operational, financial, and environmental practices. A signing date is proposed for 10 weeks from now, with a 20% earn-out based on EBITDA growth over three years post-acquisition.\n\nThis offer is pending further negotiation to ensure alignment with both companies' strategic goals.\n\n```json\n{\n  \"valuation\": \"$50 million\",\n  \"payment_structure\": \"70% cash, 30% stock\",\n  \"earn_out\": \"Up to 20% based on EBITDA growth over 3 years\",\n  \"due_diligence_timeline\": \"8 weeks\",\n  \"signing_date\": \"10 weeks from the start of negotiations\",\n  \"other_key_terms\": {\n    \"sustainability_commitment\": \"Alignment with eco-friendly practices\",\n    \"technological_integration\": \"Adoption of Verde Madera's advanced technologies\"\n  }\n}\n```\n\nCompany Negotiation State: pending\nTARGET:\nVerde Madera Industries appreciates the proposal from True North Timber Co. and recognizes the strategic alignment between our companies. We are pleased to see the emphasis on sustainability and mutual growth. However, we believe certain aspects of the offer can be further refined to reflect the full value and potential of our company.\n\n**Valuation:**\nWe propose revising the valuation to $75 million, representing 1.5 times our annual revenue at the higher end of our range. This adjustment accounts for our strong market position, growth potential, and the unique value of our sustainable practices.\n\n**Payment Structure:**\nWe suggest modifying the payment structure to 80% cash and 20% stock. This change ensures immediate value for our shareholders while maintaining alignment with long-term goals through equity participation.\n\n**Earn-out:**\nWe recommend expanding the earn-out structure to include specific sustainability metrics alongside EBITDA growth, ensuring our environmental commitments remain central to the agreement.\n\n**Due Diligence and Timeline:**\nTo ensure a thorough review, we propose extending the due diligence period to 10 weeks and the signing date to 12 weeks from the start of negotiations.\n\n**Key Synergies and Potential Friction:**\nWe highlight the alignment in sustainability and international market expansion. However, we must safeguard our operational independence in R&D and eco-friendly practices to preserve our core identity.\n\n**Unspoken Interests:**\nWe emphasize the importance of maintaining our operational independence and sustainability practices, crucial for our continued growth and market presence.\n\n```json\n{\n  \"valuation\": \"$75 million\",\n  \"payment_structure\": \"80% cash, 20% stock\",\n  \"earn_out\": \"Up to 20% based on EBITDA growth and sustainability metrics over 3 years\",\n  \"due_diligence_timeline\": \"10 weeks\",\n  \"signing_date\": \"12 weeks from the start of negotiations\",\n  \"other_key_terms\": {\n    \"sustainability_commitment\": \"Maintenance of Verde Madera's operational independence in R&D and eco-friendly practices\",\n    \"technological_integration\": \"Adoption of Verde Madera's advanced technologies with preserved autonomy\"\n  }\n}\n```\n\nCompany Negotiation State: pending\nACQUIRER:\n**Official Negotiation Response from True North Timber Co.:**\n\nWe appreciate Verde Madera Industries' thoughtful counterproposal and acknowledge the strategic alignment between our companies. Our aim is to reach a mutually beneficial agreement that respects both parties' interests while driving sustainable growth.\n\n**Valuation:**\nWe are prepared to consider a valuation of $60 million, representing a multiple closer to the higher end of the target's revenue range. This reflects the value we place on Verde Madera's market position and growth potential.\n\n**Payment Structure:**\nWe propose a payment structure of 75% cash and 25% stock. This adjustment provides immediate value to Verde Madera's shareholders while maintaining a significant equity stake to align our long-term interests.\n\n**Earn-out:**\nWe agree to an earn-out structure that includes both EBITDA growth and sustainability metrics. Specifically, we propose a 20% earn-out, with 15% tied to EBITDA growth and 5% tied to achieving specific sustainability milestones.\n\n**Due Diligence and Timeline:**\nWe accept extending the due diligence period to 9 weeks and the signing date to 11 weeks, striking a balance between thoroughness and expediency.\n\n**Operational Independence:**\nWe respect Verde Madera's desire to maintain operational independence in R&D and eco-friendly practices. We propose establishing a joint committee to ensure collaboration while preserving autonomy, allowing for the sharing of best practices.\n\n**Unspoken Interests:**\nWe emphasize the importance of accessing sustainable raw materials and advanced technologies, which will be structured into the agreement with specific clauses ensuring resource access and technology sharing.\n\n```json\n{\n  \"valuation\": \"$60 million\",\n  \"payment_structure\": \"75% cash, 25% stock\",\n  \"earn_out\": \"Up to 20% (15% based on EBITDA growth, 5% on sustainability metrics) over 3 years\",\n  \"due_diligence_timeline\": \"9 weeks\",\n  \"signing_date\": \"11 weeks from the start of negotiations\",\n  \"other_key_terms\": {\n    \"sustainability_commitment\": \"Inclusion of specific sustainability milestones in earn-out\",\n    \"technological_integration\": \"Joint committee for collaboration while preserving R&D autonomy\"\n  }\n}\n```\n\n**Company Negotiation State:** pending\nTARGET:\n**Official Negotiation Response from Verde Madera Industries:**\n\nWe appreciate True North Timber Co.'s revised offer and acknowledge the progress made towards a mutually beneficial agreement. We are committed to reaching a deal that honors both companies' strategic objectives and sustainability values.\n\n**Valuation:**\nWe propose a valuation of $65 million, reflecting 1.3 times our annual revenue at the higher end of our range. This adjustment accounts for our strong market position, growth potential, and the unique value of our sustainable practices.\n\n**Payment Structure:**\nWe suggest maintaining an 80% cash and 20% stock structure to provide immediate value to our shareholders while aligning our long-term interests.\n\n**Earn-out:**\nWe agree to an earn-out structure of 20%, with 15% tied to EBITDA growth and 5% to specific sustainability milestones, ensuring our environmental commitments remain central to the agreement.\n\n**Due Diligence and Timeline:**\nWe propose a 10-week due diligence period to ensure thoroughness and a signing date of 12 weeks from the start of negotiations.\n\n**Operational Independence:**\nWe welcome the idea of a joint committee to facilitate collaboration while preserving our R&D autonomy and eco-friendly practices.\n\n**Unspoken Interests:**\nWe emphasize the importance of maintaining our operational independence and sustainability practices, crucial for our continued growth and market presence.\n\n```json\n{\n  \"valuation\": \"$65 million\",\n  \"payment_structure\": \"80% cash, 20% stock\",\n  \"earn_out\": \"Up to 20% (15% based on EBITDA growth, 5% on sustainability metrics) over 3 years\",\n  \"due_diligence_timeline\": \"10 weeks\",\n  \"signing_date\": \"12 weeks from the start of negotiations\",\n  \"other_key_terms\": {\n    \"sustainability_commitment\": \"Inclusion of specific sustainability milestones in earn-out\",\n    \"technological_integration\": \"Joint committee for collaboration while preserving R&D autonomy\"\n  }\n}\n```\n\n**Company Negotiation State:** pending\nACQUIRER:\n**Official Negotiation Response from True North Timber Co.:**\n\nWe acknowledge Verde Madera Industries' latest counteroffer and appreciate the continued dialogue. Our goal remains to reach a balanced agreement that reflects the value and potential of both companies.\n\n**Valuation:**\nWe propose a valuation of $62.5 million, representing a midpoint between our previous offer and Verde Madera's counterproposal. This amount acknowledges the target's strong market position and growth potential while aligning with our financial constraints.\n\n**Payment Structure:**\nWe suggest a payment structure of 78% cash and 22% stock. This adjustment provides a higher cash component to meet Verde Madera's preferences while maintaining a significant equity stake to ensure long-term alignment.\n\n**Earn-out:**\nThe earn-out structure of 20% (15% based on EBITDA growth and 5% on sustainability metrics) remains acceptable as it ties directly to measurable performance and sustainability goals.\n\n**Due Diligence and Timeline:**\nWe agree to extend the due diligence period to 10 weeks and the signing date to 12 weeks from the start of negotiations, ensuring a thorough review process.\n\n**Operational Independence:**\nWe reaffirm our commitment to preserving Verde Madera's operational independence in R&D and eco-friendly practices. The joint committee will facilitate collaboration while respecting autonomy, ensuring the integration of best practices.\n\n**Unspoken Interests:**\nThe joint committee will also address our interests in sustainable raw materials and technological integration, fostering mutual benefits.\n\n```json\n{\n  \"valuation\": \"$62.5 million\",\n  \"payment_structure\": \"78% cash, 22% stock\",\n  \"earn_out\": \"Up to 20% (15% based on EBITDA growth, 5% on sustainability metrics) over 3 years\",\n  \"due_diligence_timeline\": \"10 weeks\",\n  \"signing_date\": \"12 weeks from the start of negotiations\",\n  \"other_key_terms\": {\n    \"sustainability_commitment\": \"Inclusion of specific sustainability milestones in earn-out\",\n    \"technological_integration\": \"Joint committee for collaboration while preserving R&D autonomy\"\n  }\n}\n```\n\n**Company Negotiation State:** pending\nTARGET:\n**Official Negotiation Response from Verde Madera Industries:**\n\nWe appreciate True North Timber Co.'s revised offer and acknowledge the progress made towards a balanced agreement. We are committed to reaching a deal that respects both companies' strategic objectives and sustainability values.\n\n**Valuation:**\nWe accept the valuation of $62.5 million, recognizing it as a reasonable compromise that reflects the value and potential of our company.\n\n**Payment Structure:**\nWe propose adjusting the payment structure to 80% cash and 20% stock to better align with our shareholders' interests while maintaining long-term alignment through equity participation.\n\n**Earn-out:**\nWe agree to the earn-out structure of 20%, with 15% tied to EBITDA growth and 5% to specific sustainability metrics. However, we suggest increasing the sustainability component to 6% to further emphasize our environmental commitments.\n\n**Due Diligence and Timeline:**\nWe confirm the 10-week due diligence period and 12-week signing date, ensuring a thorough review process.\n\n**Operational Independence:**\nWe welcome the joint committee structure to facilitate collaboration while preserving our R&D autonomy and eco-friendly practices. We request contractual assurances to protect our operational independence.\n\n**Unspoken Interests:**\nWe emphasize the importance of maintaining our sustainability practices and R&D autonomy, crucial for our continued growth and market presence.\n\n```json\n{\n  \"valuation\": \"$62.5 million\",\n  \"payment_structure\": \"80% cash, 20% stock\",\n  \"earn_out\": \"Up to 20% (15% based on EBITDA growth, 6% on sustainability metrics) over 3 years\",\n  \"due_diligence_timeline\": \"10 weeks\",\n  \"signing_date\": \"12 weeks from the start of negotiations\",\n  \"other_key_terms\": {\n    \"sustainability_commitment\": \"Inclusion of specific sustainability milestones in earn-out\",\n    \"technological_integration\": \"Joint committee for collaboration while preserving R&D autonomy\",\n    \"operational_independence\": \"Contractual assurances to protect Verde Madera's R&D autonomy\"\n  }\n}\n```\n\n**Company Negotiation State:** pending\n <think>",
    "negotiation_state": "complete",
    "term_sheet_snapshot": {
      "valuation": "$62.5 million",
      "payment_structure": "79% cash, 21% stock",
      "earn_out": "Up to 20% (15% based on EBITDA growth, 6% on sustainability metrics) over 3 years",
      "due_diligence_timeline": "10 weeks",
      "signing_date": "12 weeks from the start of negotiations",
      "other_key_terms": {
        "sustainability_commitment": "Inclusion of specific, measurable sustainability milestones in earn-out",
        "technological_integration": "Joint committee for collaboration while preserving R&D autonomy; clauses for sustainable raw material access and technology sharing",
        "operational_independence": "Contractual assurances to protect Verde Madera's R&D autonomy"
      }
    }
  },
  {
    "role": "target",
    "message": "**Official Negotiation Response from Verde Madera Industries:**\n\nWe appreciate the comprehensive offer from True North Timber Co. and are pleased with the progress made towards a balanced agreement that respects both companies' strategic objectives and sustainability values.\n\n**Valuation:**\nWe accept the valuation of $62.5 million, recognizing it as a fair reflection of our company's value and growth potential.\n\n**Payment Structure:**\nWe agree to the payment structure of 79% cash and 21% stock, acknowledging it as a reasonable compromise that balances immediate value for our shareholders with long-term alignment through equity participation.\n\n**Earn-out:**\nWe confirm the earn-out structure of 20%, with 15% tied to EBITDA growth and 6% to specific sustainability metrics. We appreciate the inclusion of measurable sustainability milestones, which align with our environmental commitments.\n\n**Due Diligence and Timeline:**\nWe confirm the 10-week due diligence period and 12-week signing date, ensuring a thorough review process.\n\n**Operational Independence:**\nWe welcome the joint committee structure to facilitate collaboration while preserving our R&D autonomy and eco-friendly practices. The contractual assurances provided will effectively protect our operational independence.\n\n**Technological Integration:**\nWe acknowledge the inclusion of specific clauses for sustainable raw material access and technology sharing, which will foster mutual benefits while respecting our autonomy.\n\nGiven the alignment on all key terms and the assurances provided, we are satisfied with the proposed agreement.\n\n```json\n{\n  \"valuation\": \"$62.5 million\",\n  \"payment_structure\": \"79% cash, 21% stock\",\n  \"earn_out\": \"Up to 20% (15% based on EBITDA growth, 6% on sustainability metrics) over 3 years\",\n  \"due_diligence_timeline\": \"10 weeks\",\n  \"signing_date\": \"12 weeks from the start of negotiations\",\n  \"other_key_terms\": {\n    \"sustainability_commitment\": \"Inclusion of specific, measurable sustainability milestones in earn-out\",\n    \"technological_integration\": \"Joint committee for collaboration while preserving R&D autonomy; clauses for sustainable raw material access and technology sharing\",\n    \"operational_independence\": \"Contractual assurances to protect Verde Madera's R&D autonomy\"\n  }\n}\n```\n\n**Company Negotiation State:** complete",
    "reasoning": "",
    "query": "Below is the ongoing negotiation history between your company and the other party. \nContinue the conversation by providing your company's official negotiation response. \n\nFocus on these M&A deal points:\n- Valuation (provide a numeric figure or multiple, e.g. $XX million, X times revenue, etc.)\n- Payment Structure (cash, stock, earn-out terms, etc.)\n- Key Synergies and Potential Friction (where do you see alignment or conflict?)\n- Due Diligence / Timeline (how long for diligence, when to sign definitive agreements?)\n- Any Pending Requests from the other side not yet addressed\n\nRemember:\n- Push for your company's best interests\n- Reflect your company's culture, authority dynamics, and unspoken interests\n- Do not include salutations or sign-offs\n- Maintain a professional, concise tone\n\nIf you propose or change any terms, please append an updated term sheet in **JSON** at the end of your response. \nUse a structure like:\n```json\n{\n  \"valuation\": \"...\",\n  \"payment_structure\": \"...\",\n  \"earn_out\": \"...\",\n  \"due_diligence_timeline\": \"...\",\n  \"other_key_terms\": \"...\",\n  ...\n}\n```\nIf you do not propose any changes, you can reaffirm existing terms or omit the JSON.\n\nFinally, be sure to end with:\n\nCompany Negotiation State: [pending or complete].\n\n- pending: your company still wishes to negotiate the terms\n- complete: your company is satified and will agree to the terms\n\nNegotiation History: \nACQUIRER:\nTrue North Timber Co. is pleased to initiate discussions for the acquisition of Verde Madera Industries. Our proposal reflects a strategic alignment with both companies' commitments to sustainability and growth in the forestry sector.\n\nWe propose a valuation of $50 million, representing 1.5 times Verde Madera's annual revenue, recognizing the company's strong position in sustainable wood products. The payment structure will be 70% cash and 30% stock in True North Timber Co., ensuring alignment with our long-term vision.\n\nKey synergies include integrating Verde Madera's innovative eco-friendly practices and expanding our market presence in Brazil. Potential friction points, such as cultural integration, will be addressed through collaborative communication and mutual respect.\n\nWe plan an 8-week due diligence period to review operational, financial, and environmental practices. A signing date is proposed for 10 weeks from now, with a 20% earn-out based on EBITDA growth over three years post-acquisition.\n\nThis offer is pending further negotiation to ensure alignment with both companies' strategic goals.\n\n```json\n{\n  \"valuation\": \"$50 million\",\n  \"payment_structure\": \"70% cash, 30% stock\",\n  \"earn_out\": \"Up to 20% based on EBITDA growth over 3 years\",\n  \"due_diligence_timeline\": \"8 weeks\",\n  \"signing_date\": \"10 weeks from the start of negotiations\",\n  \"other_key_terms\": {\n    \"sustainability_commitment\": \"Alignment with eco-friendly practices\",\n    \"technological_integration\": \"Adoption of Verde Madera's advanced technologies\"\n  }\n}\n```\n\nCompany Negotiation State: pending\nTARGET:\nVerde Madera Industries appreciates the proposal from True North Timber Co. and recognizes the strategic alignment between our companies. We are pleased to see the emphasis on sustainability and mutual growth. However, we believe certain aspects of the offer can be further refined to reflect the full value and potential of our company.\n\n**Valuation:**\nWe propose revising the valuation to $75 million, representing 1.5 times our annual revenue at the higher end of our range. This adjustment accounts for our strong market position, growth potential, and the unique value of our sustainable practices.\n\n**Payment Structure:**\nWe suggest modifying the payment structure to 80% cash and 20% stock. This change ensures immediate value for our shareholders while maintaining alignment with long-term goals through equity participation.\n\n**Earn-out:**\nWe recommend expanding the earn-out structure to include specific sustainability metrics alongside EBITDA growth, ensuring our environmental commitments remain central to the agreement.\n\n**Due Diligence and Timeline:**\nTo ensure a thorough review, we propose extending the due diligence period to 10 weeks and the signing date to 12 weeks from the start of negotiations.\n\n**Key Synergies and Potential Friction:**\nWe highlight the alignment in sustainability and international market expansion. However, we must safeguard our operational independence in R&D and eco-friendly practices to preserve our core identity.\n\n**Unspoken Interests:**\nWe emphasize the importance of maintaining our operational independence and sustainability practices, crucial for our continued growth and market presence.\n\n```json\n{\n  \"valuation\": \"$75 million\",\n  \"payment_structure\": \"80% cash, 20% stock\",\n  \"earn_out\": \"Up to 20% based on EBITDA growth and sustainability metrics over 3 years\",\n  \"due_diligence_timeline\": \"10 weeks\",\n  \"signing_date\": \"12 weeks from the start of negotiations\",\n  \"other_key_terms\": {\n    \"sustainability_commitment\": \"Maintenance of Verde Madera's operational independence in R&D and eco-friendly practices\",\n    \"technological_integration\": \"Adoption of Verde Madera's advanced technologies with preserved autonomy\"\n  }\n}\n```\n\nCompany Negotiation State: pending\nACQUIRER:\n**Official Negotiation Response from True North Timber Co.:**\n\nWe appreciate Verde Madera Industries' thoughtful counterproposal and acknowledge the strategic alignment between our companies. Our aim is to reach a mutually beneficial agreement that respects both parties' interests while driving sustainable growth.\n\n**Valuation:**\nWe are prepared to consider a valuation of $60 million, representing a multiple closer to the higher end of the target's revenue range. This reflects the value we place on Verde Madera's market position and growth potential.\n\n**Payment Structure:**\nWe propose a payment structure of 75% cash and 25% stock. This adjustment provides immediate value to Verde Madera's shareholders while maintaining a significant equity stake to align our long-term interests.\n\n**Earn-out:**\nWe agree to an earn-out structure that includes both EBITDA growth and sustainability metrics. Specifically, we propose a 20% earn-out, with 15% tied to EBITDA growth and 5% tied to achieving specific sustainability milestones.\n\n**Due Diligence and Timeline:**\nWe accept extending the due diligence period to 9 weeks and the signing date to 11 weeks, striking a balance between thoroughness and expediency.\n\n**Operational Independence:**\nWe respect Verde Madera's desire to maintain operational independence in R&D and eco-friendly practices. We propose establishing a joint committee to ensure collaboration while preserving autonomy, allowing for the sharing of best practices.\n\n**Unspoken Interests:**\nWe emphasize the importance of accessing sustainable raw materials and advanced technologies, which will be structured into the agreement with specific clauses ensuring resource access and technology sharing.\n\n```json\n{\n  \"valuation\": \"$60 million\",\n  \"payment_structure\": \"75% cash, 25% stock\",\n  \"earn_out\": \"Up to 20% (15% based on EBITDA growth, 5% on sustainability metrics) over 3 years\",\n  \"due_diligence_timeline\": \"9 weeks\",\n  \"signing_date\": \"11 weeks from the start of negotiations\",\n  \"other_key_terms\": {\n    \"sustainability_commitment\": \"Inclusion of specific sustainability milestones in earn-out\",\n    \"technological_integration\": \"Joint committee for collaboration while preserving R&D autonomy\"\n  }\n}\n```\n\n**Company Negotiation State:** pending\nTARGET:\n**Official Negotiation Response from Verde Madera Industries:**\n\nWe appreciate True North Timber Co.'s revised offer and acknowledge the progress made towards a mutually beneficial agreement. We are committed to reaching a deal that honors both companies' strategic objectives and sustainability values.\n\n**Valuation:**\nWe propose a valuation of $65 million, reflecting 1.3 times our annual revenue at the higher end of our range. This adjustment accounts for our strong market position, growth potential, and the unique value of our sustainable practices.\n\n**Payment Structure:**\nWe suggest maintaining an 80% cash and 20% stock structure to provide immediate value to our shareholders while aligning our long-term interests.\n\n**Earn-out:**\nWe agree to an earn-out structure of 20%, with 15% tied to EBITDA growth and 5% to specific sustainability milestones, ensuring our environmental commitments remain central to the agreement.\n\n**Due Diligence and Timeline:**\nWe propose a 10-week due diligence period to ensure thoroughness and a signing date of 12 weeks from the start of negotiations.\n\n**Operational Independence:**\nWe welcome the idea of a joint committee to facilitate collaboration while preserving our R&D autonomy and eco-friendly practices.\n\n**Unspoken Interests:**\nWe emphasize the importance of maintaining our operational independence and sustainability practices, crucial for our continued growth and market presence.\n\n```json\n{\n  \"valuation\": \"$65 million\",\n  \"payment_structure\": \"80% cash, 20% stock\",\n  \"earn_out\": \"Up to 20% (15% based on EBITDA growth, 5% on sustainability metrics) over 3 years\",\n  \"due_diligence_timeline\": \"10 weeks\",\n  \"signing_date\": \"12 weeks from the start of negotiations\",\n  \"other_key_terms\": {\n    \"sustainability_commitment\": \"Inclusion of specific sustainability milestones in earn-out\",\n    \"technological_integration\": \"Joint committee for collaboration while preserving R&D autonomy\"\n  }\n}\n```\n\n**Company Negotiation State:** pending\nACQUIRER:\n**Official Negotiation Response from True North Timber Co.:**\n\nWe acknowledge Verde Madera Industries' latest counteroffer and appreciate the continued dialogue. Our goal remains to reach a balanced agreement that reflects the value and potential of both companies.\n\n**Valuation:**\nWe propose a valuation of $62.5 million, representing a midpoint between our previous offer and Verde Madera's counterproposal. This amount acknowledges the target's strong market position and growth potential while aligning with our financial constraints.\n\n**Payment Structure:**\nWe suggest a payment structure of 78% cash and 22% stock. This adjustment provides a higher cash component to meet Verde Madera's preferences while maintaining a significant equity stake to ensure long-term alignment.\n\n**Earn-out:**\nThe earn-out structure of 20% (15% based on EBITDA growth and 5% on sustainability metrics) remains acceptable as it ties directly to measurable performance and sustainability goals.\n\n**Due Diligence and Timeline:**\nWe agree to extend the due diligence period to 10 weeks and the signing date to 12 weeks from the start of negotiations, ensuring a thorough review process.\n\n**Operational Independence:**\nWe reaffirm our commitment to preserving Verde Madera's operational independence in R&D and eco-friendly practices. The joint committee will facilitate collaboration while respecting autonomy, ensuring the integration of best practices.\n\n**Unspoken Interests:**\nThe joint committee will also address our interests in sustainable raw materials and technological integration, fostering mutual benefits.\n\n```json\n{\n  \"valuation\": \"$62.5 million\",\n  \"payment_structure\": \"78% cash, 22% stock\",\n  \"earn_out\": \"Up to 20% (15% based on EBITDA growth, 5% on sustainability metrics) over 3 years\",\n  \"due_diligence_timeline\": \"10 weeks\",\n  \"signing_date\": \"12 weeks from the start of negotiations\",\n  \"other_key_terms\": {\n    \"sustainability_commitment\": \"Inclusion of specific sustainability milestones in earn-out\",\n    \"technological_integration\": \"Joint committee for collaboration while preserving R&D autonomy\"\n  }\n}\n```\n\n**Company Negotiation State:** pending\nTARGET:\n**Official Negotiation Response from Verde Madera Industries:**\n\nWe appreciate True North Timber Co.'s revised offer and acknowledge the progress made towards a balanced agreement. We are committed to reaching a deal that respects both companies' strategic objectives and sustainability values.\n\n**Valuation:**\nWe accept the valuation of $62.5 million, recognizing it as a reasonable compromise that reflects the value and potential of our company.\n\n**Payment Structure:**\nWe propose adjusting the payment structure to 80% cash and 20% stock to better align with our shareholders' interests while maintaining long-term alignment through equity participation.\n\n**Earn-out:**\nWe agree to the earn-out structure of 20%, with 15% tied to EBITDA growth and 5% to specific sustainability metrics. However, we suggest increasing the sustainability component to 6% to further emphasize our environmental commitments.\n\n**Due Diligence and Timeline:**\nWe confirm the 10-week due diligence period and 12-week signing date, ensuring a thorough review process.\n\n**Operational Independence:**\nWe welcome the joint committee structure to facilitate collaboration while preserving our R&D autonomy and eco-friendly practices. We request contractual assurances to protect our operational independence.\n\n**Unspoken Interests:**\nWe emphasize the importance of maintaining our sustainability practices and R&D autonomy, crucial for our continued growth and market presence.\n\n```json\n{\n  \"valuation\": \"$62.5 million\",\n  \"payment_structure\": \"80% cash, 20% stock\",\n  \"earn_out\": \"Up to 20% (15% based on EBITDA growth, 6% on sustainability metrics) over 3 years\",\n  \"due_diligence_timeline\": \"10 weeks\",\n  \"signing_date\": \"12 weeks from the start of negotiations\",\n  \"other_key_terms\": {\n    \"sustainability_commitment\": \"Inclusion of specific sustainability milestones in earn-out\",\n    \"technological_integration\": \"Joint committee for collaboration while preserving R&D autonomy\",\n    \"operational_independence\": \"Contractual assurances to protect Verde Madera's R&D autonomy\"\n  }\n}\n```\n\n**Company Negotiation State:** pending\nACQUIRER:\n**Official Negotiation Response from True North Timber Co.:**\n\nWe appreciate Verde Madera Industries' latest counteroffer and recognize the progress made towards a balanced agreement. Our goal remains to reach a mutually beneficial deal that respects both companies' strategic objectives and sustainability values.\n\n**Valuation:**\nWe reaffirm the valuation of $62.5 million, which we believe fairly reflects the value and potential of Verde Madera Industries.\n\n**Payment Structure:**\nWe propose a payment structure of 79% cash and 21% stock, striking a balance between immediate value for Verde Madera's shareholders and long-term alignment through equity participation.\n\n**Earn-out:**\nWe accept the earn-out structure of 20%, with 15% tied to EBITDA growth and 6% to specific sustainability metrics. We will ensure these metrics are clear, measurable, and aligned with our shared environmental commitments.\n\n**Due Diligence and Timeline:**\nWe confirm the 10-week due diligence period and 12-week signing date, ensuring a thorough review process.\n\n**Operational Independence:**\nWe agree to establish a joint committee to facilitate collaboration while preserving Verde Madera's R&D autonomy and eco-friendly practices. Contractual assurances will be included to protect this autonomy.\n\n**Technological Integration:**\nWe propose including specific clauses in the agreement to ensure access to sustainable raw materials and advanced technologies, fostering mutual benefits while respecting Verde Madera's operational independence.\n\n```json\n{\n  \"valuation\": \"$62.5 million\",\n  \"payment_structure\": \"79% cash, 21% stock\",\n  \"earn_out\": \"Up to 20% (15% based on EBITDA growth, 6% on sustainability metrics) over 3 years\",\n  \"due_diligence_timeline\": \"10 weeks\",\n  \"signing_date\": \"12 weeks from the start of negotiations\",\n  \"other_key_terms\": {\n    \"sustainability_commitment\": \"Inclusion of specific, measurable sustainability milestones in earn-out\",\n    \"technological_integration\": \"Joint committee for collaboration while preserving R&D autonomy; clauses for sustainable raw material access and technology sharing\",\n    \"operational_independence\": \"Contractual assurances to protect Verde Madera's R&D autonomy\"\n  }\n}\n```\n\n**Company Negotiation State:** complete\n <think>",
    "negotiation_state": "complete",
    "term_sheet_snapshot": {
      "valuation": "$62.5 million",
      "payment_structure": "79% cash, 21% stock",
      "earn_out": "Up to 20% (15% based on EBITDA growth, 6% on sustainability metrics) over 3 years",
      "due_diligence_timeline": "10 weeks",
      "signing_date": "12 weeks from the start of negotiations",
      "other_key_terms": {
        "sustainability_commitment": "Inclusion of specific, measurable sustainability milestones in earn-out",
        "technological_integration": "Joint committee for collaboration while preserving R&D autonomy; clauses for sustainable raw material access and technology sharing",
        "operational_independence": "Contractual assurances to protect Verde Madera's R&D autonomy"
      }
    }
  }
]